{
  "chapter_title": "第八卷 上古隐秘_第两千八百零七章 仙府奇珍与先天灵宝",
  "chapter_outline": [
    "借林轩视角揭示先天灵宝与仙府奇珍的本质差异：前者威力强却不能成长，后者为本命宝物可随主人成长。",
    "回溯天巫神女融合九剑失败，突出林轩集齐域外天金与幻灵魔花，成为有史以来第二个有望炼成九宫须臾剑的人。",
    "林轩闭关百年，将九种属性九宫须臾剑成功融合，剑成引发山谷坍塌、银芒化凤的天地异象。",
    "完整版九宫须臾剑浮现《真灵化剑诀》，林轩参悟后揭开“墨玉真灵诀”炼制真灵之血的隐秘，断章于真正好处将揭未揭处。"
  ],
  "truth_base": {
    "protagonist_plan": "孤注一掷完成九种属性融合，借域外天金与幻灵魔花将九宫须臾剑推至可成长、可媲美仙府奇珍的层次，并参悟剑成后浮现的《真灵化剑诀》。",
    "antagonist_horizon": "渡劫期大能仍困于先天灵宝与仙府奇珍的区别；天巫神女曾觊觎域外天金与幻灵魔花却因稀有和难度放弃；外界老怪物只看见一道光影掠过，无法辨清凤凰与林轩真身。",
    "information_gap": "外界不知林轩已集齐天巫神女都眼红的两种材料并成功融合九剑；林轩也尚未完全参透“墨玉真灵诀”与真灵之血融合的真正深层好处，解释在断章处被截断。",
    "deadline": "融合机会极少，材料几乎不可能再次集齐，失败便无重来可能；百年功成后剑诀初现，参悟与隐秘真相的窗口已迫在眉睫。"
  },
  "segments": {
    "opening": {
      "anchor_start": "林轩不知道，一直困扰渡劫期大能的谜题，先天灵宝与仙府奇珍的区别，就在于此。",
      "anchor_end": "而九宫须臾剑作为墨月族传说中最为强大的宝物，是有潜力，演化为仙府奇珍的。",
      "text": "林轩不知道，一直困扰渡劫期大能的谜题，先天灵宝与仙府奇珍的区别，就在于此。\n\n两者皆是仙家之物，只不过仙府奇珍乃是仙人的本命宝物，可以随主人的强大，而不断成长，而先天灵宝则类似于古宝，威力有可能比仙府奇珍更强，但却不能够成长。\n\n而九宫须臾剑作为墨月族传说中最为强大的宝物，是有潜力，演化为仙府奇珍的。",
      "word_count": 151
    },
    "ramp_up": {
      "anchor_start": "听起来是不是很离谱？",
      "anchor_end": "林轩袖袍一拂，灵光大做，一柄柄的仙剑由衣袖中鱼游而出，在身体周围盘旋飞舞。",
      "text": "听起来是不是很离谱？\n\n先前，在上古的时候，天巫神女就朝着这个目标努力过，只不过，她失败了。\n\n天巫神女很强，但比之真仙，毕竟是差了一些，九宫须臾剑与主人的实力成正比，于是，距离仙府奇珍那样的品级，也就或多或少的逊色一些。\n\n墨月天巫诀的要求极为苛刻，修炼的人本就不多，九宫须臾剑的炼制更为繁复，墨月族在辉煌的时候，虽然也出现了不少天才，但除了天巫神女，再也没有人，能够将九种属性的仙剑融合。\n\n换言之，林轩算是有史以来的第二个。\n\n而且比之天巫神女，林轩手中的九宫须臾剑更有优势。\n\n这并非无的放矢，机缘巧合，林轩的本命法宝还融入了域外天金与幻灵魔花这两种材料。\n\n幻灵魔花暂且不提，便是当年阿修罗王也只找到少许。\n\n域外天金更离谱，用可遇而不可求来形容都完全不足。\n\n就算是真仙，遇见域外天魔也有可能被迷惑，想要从其身上得到域外天金那不是虎口夺食么？\n\n总之，这两样宝物，天巫神女当年也觊觎过，但却因为稀有与难度不得不最终放弃掉了。\n\n而林轩作为后来者，运气显然更胜一筹，当初天巫神女眼红的两种宝贝他都有。\n\n也就是说，林轩若是能将九种属性成功融合，他所拥有的九宫须臾剑的品质，甚至还要胜过天巫神女许多。\n\n若是有朝一日自己能够进阶到渡劫后期，此宝的品质，绝对不会比仙府奇珍逊色。\n\n这中间的道理，林轩还不完全清楚，但他至少晓得，拥有九种属性的九宫须臾剑，乃是旷世难寻的宝物。\n\n只许成功，不许失败，毕竟尝试的机会不多，这一次若是没有能够成功融合，想要再找齐这些材料，几乎是不可能完成的任务。\n\n一点也不可以大意疏忽。\n\n好在这三个月的休息，已将自己的精气神养足。\n\n林轩袖袍一拂，灵光大做，一柄柄的仙剑由衣袖中鱼游而出，在身体周围盘旋飞舞。",
      "word_count": 723
    },
    "climax": {
      "core_conflict": "核心冲突是林轩与九种属性融合极限的百年对赌；反杀形式是九剑功成引发山崩地裂、银芒化凤，并以《真灵化剑诀》自现完成底牌跃迁。",
      "anchor_start": "林轩袖袍一拂，灵光大做，一柄柄的仙剑由衣袖中鱼游而出，在身体周围盘旋飞舞。",
      "anchor_end": "但若是他们看清楚，在那凤凰的背上，居然还站着一名修仙者，就不晓得，心中会作何感想了。",
      "text": "林轩袖袍一拂，灵光大做，一柄柄的仙剑由衣袖中鱼游而出，在身体周围盘旋飞舞。\n\n此时此刻，九宫须臾剑长不过寸许左右。\n\n林轩可不敢将牠们放大的，否则，练功房虽然宽敞，也必然装不下这么多仙剑宝物。\n\n随后他又伸出手来，在腰间一拍，顿时手中就出现了一个储物袋。\n\n这是数月前，银瞳少女交给他的宝物，乃是云隐宗与天绝门弟子费了数千年功夫，才好不容易找到的。\n\n林轩右手翻转，手中储物袋口立刻袋口朝下，一片白席卷而出。\n\n叮叮当当的声音传入耳朵，随即一大堆东西在地上显露。\n\n瓶瓶罐罐，木匣玉盒，不一而足。\n\n而这还没有结束，随后，林轩又是袖袍一甩，将自己收集到的宝物取了出来。\n\n放眼望去，数量极为繁多，居然有近千种，每一样，都是极为珍稀的宝物。\n\n数量这么多，可想而知当初，收罗牠们的难度，同时，想要将这么多种材料，全部融合进九宫须臾剑中，那难度如何，也就不难猜测。\n\n……\n\n修仙无岁月，一年又一载。\n\n花儿开了又谢，谢了又开，唯有林轩洞府的大门，始终紧闭，已不知道多少年不曾开启。\n\n洞府外，早已也铺上了一层厚厚地尘土，看上去，就仿佛恒古不曾有人来过的古墓。\n\n山中无岁月，一晃又百年。\n\n这天。\n\n轰！\n\n爆裂声传入耳朵，与晴天霹雳相差仿佛。\n\n半分征兆也无，林轩洞府所在的山谷，居然莫名其妙的坍塌掉了。\n\n没错，化为了一片废墟，四周的山峰全部坍塌了下去，随后一耀目的光华冲天而起。\n\n那光华乃是一道银芒，直冲入九霄之上。\n\n随后，居然变成了一展翅欲飞的凤凰。\n\n身长百余丈，两翅一展，更是有如遮天蔽日一般，那气势骇人到极点。\n\n若是有修仙者，肯定会吓得瞠目结舌，以为天凤降临到了此处。\n\n但若是他们看清楚，在那凤凰的背上，居然还站着一名修仙者，就不晓得，心中会作何感想了。",
      "word_count": 737
    },
    "aftershock": {
      "anchor_start": "那凤凰引颈高歌，声传百里，带着林轩在天上翱翔，速度之快，令人瞠目结舌，就算是渡劫级别的老怪物，哪怕擅长飞遁之术，恐怕也是难以追上了。",
      "anchor_end": "于是林轩顾不上辛苦，细细参悟。",
      "text": "那凤凰引颈高歌，声传百里，带着林轩在天上翱翔，速度之快，令人瞠目结舌，就算是渡劫级别的老怪物，哪怕擅长飞遁之术，恐怕也是难以追上了。\n\n林轩乘着牠，一日之间，就跨越了千山万水的距离，虽然这造型是拉风以极，但没有关系，速度太快了，一般的修仙者，根本看都看不清楚。\n\n路上，林轩甚至遇见了几名同级别的老怪物，可他们也仅仅是看见一道光影从身旁掠过，具体是什么，根本就看不清楚，可想而知，这九宫须臾剑所幻化出来的凤凰，速度究竟快到了何种程度。\n\n其实一定要较真的话，这凤凰，也不能说，是幻化出来的。\n\n牠与百鸟之王，还真有那么几分关系的。\n\n百年前，林轩闭关，想要将九种属性的九宫须臾剑完全融合，这中间的艰难辛苦，不用描述，但其实，也并没有花费到一百年的功夫。\n\n等他将完整版的九宫须臾剑炼制出来以后，一篇剑诀居然浮现而出。\n\n真灵化剑诀！\n\n林轩惊愕之余，自是又惊又喜。\n\n虽然不知道为何将九种属性融合，为什么会有剑诀浮现而出，但显然，这会是非同小可之物。\n\n于是林轩顾不上辛苦，细细参悟。",
      "word_count": 442
    },
    "cliffhanger": {
      "anchor_start": "于是林轩顾不上辛苦，细细参悟。",
      "anchor_end": "表面上，将真灵之血融合，会让修士本身的体质，获得一些好处。",
      "text": "于是林轩顾不上辛苦，细细参悟。\n\n参悟之下，却让其他大惊失色……哦，不，应该是惊喜到无以复加的地步。\n\n以前的一些谜团，也一一揭开。\n\n林轩终于晓得，自己所修炼的功法中，为何会有“墨玉真灵诀”这种秘术，专门用来炼制真灵之血了。\n\n表面上，将真灵之血融合，会让修士本身的体质，获得一些好处。",
      "word_count": 144
    }
  },
  "chapter_id": "ch_2810",
  "chapter_index": 2810,
  "prev_chapter_ending": "天灵宝，原本就是从真仙界流传下来的宝物，虽然叫的名字不同，但若论威力，其实并不比仙府奇珍逊色。\n甚至有一种说法，先天灵宝，其实就是仙府奇珍的。\n当然，这种说法，并没有得到证实，严格来说，仅仅是流传于高阶修士中的一种推测而已。\n但想想，九宫须臾剑能媲美如此宝物，林轩心中，就激动到无以复加的程度。\n而且与先天灵宝不同，九宫须臾剑既然是自己的本命宝物，那牠的威力，乃是与自己实力成正比的，自己越强，九宫须臾剑相印的，也就会越强，牠可以随着自己一起成长，从这个角度，九宫须臾剑甚至可以说，还要胜过先天灵宝。",
  "contrast": {
    "prompt": "请根据以下大纲与上章承接，撰写一篇 2000~2500 字的完整小说章节：\n\n【章节标题】：第八卷 上古隐秘_第两千八百零七章 仙府奇珍与先天灵宝\n【上一章结尾】：天灵宝，原本就是从真仙界流传下来的宝物，虽然叫的名字不同，但若论威力，其实并不比仙府奇珍逊色。\n甚至有一种说法，先天灵宝，其实就是仙府奇珍的。\n当然，这种说法，并没有得到证实，严格来说，仅仅是流传于高阶修士中的一种推测而已。\n但想想，九宫须臾剑能媲美如此宝物，林轩心中，就激动到无以复加的程度。\n而且与先天灵宝不同，九宫须臾剑既然是自己的本命宝物，那牠的威力，乃是与自己实力成正比的，自己越强，九宫须臾剑相印的，也就会越强，牠可以随着自己一起成长，从这个角度，九宫须臾剑甚至可以说，还要胜过先天灵宝。\n【本章大纲】：\n1. 借林轩视角揭示先天灵宝与仙府奇珍的本质差异：前者威力强却不能成长，后者为本命宝物可随主人成长。\n2. 回溯天巫神女融合九剑失败，突出林轩集齐域外天金与幻灵魔花，成为有史以来第二个有望炼成九宫须臾剑的人。\n3. 林轩闭关百年，将九种属性九宫须臾剑成功融合，剑成引发山谷坍塌、银芒化凤的天地异象。\n4. 完整版九宫须臾剑浮现《真灵化剑诀》，林轩参悟后揭开“墨玉真灵诀”炼制真灵之血的隐秘，断章于真正好处将揭未揭处。\n\n【写作要求】：\n直接输出小说正文，保持情节连贯流畅，完成本章大纲所规划的所有情节走向。",
    "ai_draft": "第八卷 上古隐秘\n\n第两千八百零七章 仙府奇珍与先天灵宝\n\n林轩盘坐在静室之中，指尖一缕银芒缓缓流转，如一条细小的灵蛇，缠绕着九宫须臾剑的剑胚游走不息。他凝视许久，心中那点激动非但没有平复，反而愈发滚烫。\n\n先天灵宝，仙府奇珍，这两个名字他听过太多次，直到今日，才真正咂摸出其中那层最要紧的分野。\n\n若单论威能，二者孰高孰低，恐怕连真仙也说不清楚。先天灵宝自真仙界流落而下，秉天地初开之气而生，一宝在手，翻江倒海不过等闲；仙府奇珍 likewise 各有来历，玄妙处丝毫不逊。可要论“长久”二字，差距便显出来了。\n\n先天灵宝再强，也是死物。它生来是什么品阶，便永远是什么品阶，主人修为涨落，于它而言不过是换了个执掌之人。可本命宝物不同——那是修士以精血神魂温养出来的第二性命，主人越强，它便越强；主人悟得越深，它便锋锐越盛。九宫须臾剑此刻或许还及不上那些传说中的先天灵宝，可它有一件先天灵宝永远比不上的东西：它可以跟着林轩一起，往那无人踏足的高处走。\n\n“所以当年天巫神女，才非要炼它不可。”林轩低声自语。\n\n他闭上眼，脑海中浮现出那段残破的上古玉简所记。天巫神女惊才绝艳，以九种天地奇金为骨、九缕本源之气为魂，欲铸九宫须臾剑。她集齐了八柄，第九柄却始终差了一味引子，最终强融九剑，剑胎当场崩碎，神女也因此受了不可逆的道伤，郁郁而终。玉简上只留下寥寥数句：“九金易得，引子难求。无引则刚极易折，有引则九脉归一。”\n\n那味“引子”，便是域外天金与幻灵魔花。\n\n前者是九天之外坠落的星核残骸，至坚至烈，能承载九种属性而不散；后者生于幽冥幻境，柔而不弱，能将彼此相斥的九脉缝合为一。一刚一柔，一承一引，缺一不可。天巫神女穷其一生也只寻到其中一样，故而失败。\n\n而林轩，两样都拿到了。\n\n“所以我是有史以来第二个。”他睁开眼，眸底有光一闪而过，“也是第一个，有希望真正炼成的人。”\n\n他没有再多想，抬手将静室四周的禁制一一激活，又取出一枚早已备好的封灵丹服下。剑成之日，动静必大，若不早做遮掩，怕是方圆万里的修士都要被引来。\n\n闭关，始。\n\n这一闭，便是百年。\n\n山中无甲子，寒尽不知年。林轩将所有心神都沉入那九柄剑胚之中。域外天金被他以真火一寸寸熔开，化作九道银流，分别注入九柄剑胚的脊骨；幻灵魔花则被炼成一缕缕近乎透明的丝线，缠上剑脉交汇之处。起初九种属性彼此撕扯，金锐刺木、水寒灭火，整座洞府日夜轰鸣，仿佛困了一头不肯驯服的凶兽。林轩一次次以神识压制，一次次被反震得口鼻溢血，又一次次重新坐定。\n\n他记不清自己失败了多少回。只记得有一回，九脉冲突到极致，剑胚几乎重现了天巫神女当年的崩碎之相。那一刻他心头一横，索性不再强行镇压，而是以自身道基为引，将九种属性一并纳入经脉，以人身作炉，先在自己体内走通一遍。\n\n剧痛如潮水淹没神魂。可就在那剧痛之中，他忽然摸到了一丝极细微的脉络——九种属性并非不能共存，只是需要一条“河床”，让它们依次流过，而非同时相撞。域外天金是河床，幻灵魔花是堤岸，而他的道心，是那引水的水势。\n\n想通此节，后面便如水到渠成。\n\n第九十九年冬，最后一道剑纹合拢。第一百年的第一日，林轩睁开双眼。\n\n九柄剑胚在他身周静静悬浮，银光内敛，宛如九条沉睡的幼龙。他伸出手，指尖轻轻一弹。\n\n“合。”\n\n九剑应声而动。\n\n那一瞬间，整座山谷先是一静，静得连风都停了；紧接着，一声仿佛从地底深处传来的闷响炸开，山石崩裂、积雪倒卷，千丈崖壁如纸般塌落。林轩所在的洞府顶盖直接被掀飞，天光倾泻而下。九道银芒冲霄而起，在半空纠缠、盘绕、融汇，最终化作一只通体银白的巨鸟虚影，双翼一展，遮了半边天穹，长鸣一声，声震四野，而后化作漫天银雨簌簌落回。\n\n银芒化凤。\n\n方圆千里的灵兽尽数伏地，不敢仰视。\n\n林轩仰头看着那消散的凤影，胸口起伏，半晌才吐出一口浊气。他掌心一翻，一柄通体流转着九色微光的细剑浮现出来。剑身不宽，却给人一种“可斩万物”的锋锐错觉；剑脊之上，九道纹路首尾相衔，如环无端。九宫须臾剑，成了。\n\n就在剑成的刹那，一段他从未见过的古老文字，自剑身深处缓缓浮起，映在他识海之中。\n\n《真灵化剑诀》。\n\n林轩凝神读去，越读，眉头皱得越紧，呼吸也越沉。这并非寻常御剑之法，而是一套以真灵之血淬炼剑魄的秘术。剑诀开篇便写：九宫须臾剑欲成真灵，需以真灵之血为引，血纯则剑活，血浊则剑滞。而后半篇，却忽然笔锋一转，提到一部名为《墨玉真灵诀》的旁门古法——此法专讲如何从上古真灵遗骸中提炼真灵之血，且所提之血，竟能绕过“血脉相斥”之限，强行融入本命宝物。\n\n林轩目光死死钉在那几行字上，指尖不自觉地收紧。\n\n他忽然明白，天巫神女当年缺的，或许不只是域外天金与幻灵魔花。她真正缺的，是这后半篇。\n\n而这《墨玉真灵诀》中所藏的，恐怕才是九宫须臾剑真正的好处。\n\n那好处究竟是什么，玉简上的字迹，却在最关键处，戛然而止。",
    "human_original": "第八卷 上古隐秘_第两千八百零七章 仙府奇珍与先天灵宝\n\n第两千八百零七章\n\n仙府奇珍与先天灵宝\n\n林轩不知道，一直困扰渡劫期大能的谜题，先天灵宝与仙府奇珍的区别，就在于此。\n\n两者皆是仙家之物，只不过仙府奇珍乃是仙人的本命宝物，可以随主人的强大，而不断成长，而先天灵宝则类似于古宝，威力有可能比仙府奇珍更强，但却不能够成长。\n\n而九宫须臾剑作为墨月族传说中最为强大的宝物，是有潜力，演化为仙府奇珍的。\n\n听起来是不是很离谱？\n\n先前，在上古的时候，天巫神女就朝着这个目标努力过，只不过，她失败了。\n\n天巫神女很强，但比之真仙，毕竟是差了一些，九宫须臾剑与主人的实力成正比，于是，距离仙府奇珍那样的品级，也就或多或少的逊色一些。\n\n墨月天巫诀的要求极为苛刻，修炼的人本就不多，九宫须臾剑的炼制更为繁复，墨月族在辉煌的时候，虽然也出现了不少天才，但除了天巫神女，再也没有人，能够将九种属性的仙剑融合。\n\n换言之，林轩算是有史以来的第二个。\n\n而且比之天巫神女，林轩手中的九宫须臾剑更有优势。\n\n这并非无的放矢，机缘巧合，林轩的本命法宝还融入了域外天金与幻灵魔花这两种材料。\n\n幻灵魔花暂且不提，便是当年阿修罗王也只找到少许。\n\n域外天金更离谱，用可遇而不可求来形容都完全不足。\n\n就算是真仙，遇见域外天魔也有可能被迷惑，想要从其身上得到域外天金那不是虎口夺食么？\n\n总之，这两样宝物，天巫神女当年也觊觎过，但却因为稀有与难度不得不最终放弃掉了。\n\n而林轩作为后来者，运气显然更胜一筹，当初天巫神女眼红的两种宝贝他都有。\n\n也就是说，林轩若是能将九种属性成功融合，他所拥有的九宫须臾剑的品质，甚至还要胜过天巫神女许多。\n\n若是有朝一日自己能够进阶到渡劫后期，此宝的品质，绝对不会比仙府奇珍逊色。\n\n这中间的道理，林轩还不完全清楚，但他至少晓得，拥有九种属性的九宫须臾剑，乃是旷世难寻的宝物。\n\n只许成功，不许失败，毕竟尝试的机会不多，这一次若是没有能够成功融合，想要再找齐这些材料，几乎是不可能完成的任务。\n\n一点也不可以大意疏忽。\n\n好在这三个月的休息，已将自己的精气神养足。\n\n林轩袖袍一拂，灵光大做，一柄柄的仙剑由衣袖中鱼游而出，在身体周围盘旋飞舞。\n\n此时此刻，九宫须臾剑长不过寸许左右。\n\n林轩可不敢将牠们放大的，否则，练功房虽然宽敞，也必然装不下这么多仙剑宝物。\n\n随后他又伸出手来，在腰间一拍，顿时手中就出现了一个储物袋。\n\n这是数月前，银瞳少女交给他的宝物，乃是云隐宗与天绝门弟子费了数千年功夫，才好不容易找到的。\n\n林轩右手翻转，手中储物袋口立刻袋口朝下，一片白席卷而出。\n\n叮叮当当的声音传入耳朵，随即一大堆东西在地上显露。\n\n瓶瓶罐罐，木匣玉盒，不一而足。\n\n而这还没有结束，随后，林轩又是袖袍一甩，将自己收集到的宝物取了出来。\n\n放眼望去，数量极为繁多，居然有近千种，每一样，都是极为珍稀的宝物。\n\n数量这么多，可想而知当初，收罗牠们的难度，同时，想要将这么多种材料，全部融合进九宫须臾剑中，那难度如何，也就不难猜测。\n\n……\n\n修仙无岁月，一年又一载。\n\n花儿开了又谢，谢了又开，唯有林轩洞府的大门，始终紧闭，已不知道多少年不曾开启。\n\n洞府外，早已也铺上了一层厚厚地尘土，看上去，就仿佛恒古不曾有人来过的古墓。\n\n山中无岁月，一晃又百年。\n\n这天。\n\n轰！\n\n爆裂声传入耳朵，与晴天霹雳相差仿佛。\n\n半分征兆也无，林轩洞府所在的山谷，居然莫名其妙的坍塌掉了。\n\n没错，化为了一片废墟，四周的山峰全部坍塌了下去，随后一耀目的光华冲天而起。\n\n那光华乃是一道银芒，直冲入九霄之上。\n\n随后，居然变成了一展翅欲飞的凤凰。\n\n身长百余丈，两翅一展，更是有如遮天蔽日一般，那气势骇人到极点。\n\n若是有修仙者，肯定会吓得瞠目结舌，以为天凤降临到了此处。\n\n但若是他们看清楚，在那凤凰的背上，居然还站着一名修仙者，就不晓得，心中会作何感想了。\n\n那凤凰引颈高歌，声传百里，带着林轩在天上翱翔，速度之快，令人瞠目结舌，就算是渡劫级别的老怪物，哪怕擅长飞遁之术，恐怕也是难以追上了。\n\n林轩乘着牠，一日之间，就跨越了千山万水的距离，虽然这造型是拉风以极，但没有关系，速度太快了，一般的修仙者，根本看都看不清楚。\n\n路上，林轩甚至遇见了几名同级别的老怪物，可他们也仅仅是看见一道光影从身旁掠过，具体是什么，根本就看不清楚，可想而知，这九宫须臾剑所幻化出来的凤凰，速度究竟快到了何种程度。\n\n其实一定要较真的话，这凤凰，也不能说，是幻化出来的。\n\n牠与百鸟之王，还真有那么几分关系的。\n\n百年前，林轩闭关，想要将九种属性的九宫须臾剑完全融合，这中间的艰难辛苦，不用描述，但其实，也并没有花费到一百年的功夫。\n\n等他将完整版的九宫须臾剑炼制出来以后，一篇剑诀居然浮现而出。\n\n真灵化剑诀！\n\n林轩惊愕之余，自是又惊又喜。\n\n虽然不知道为何将九种属性融合，为什么会有剑诀浮现而出，但显然，这会是非同小可之物。\n\n于是林轩顾不上辛苦，细细参悟。\n\n参悟之下，却让其他大惊失色……哦，不，应该是惊喜到无以复加的地步。\n\n以前的一些谜团，也一一揭开。\n\n林轩终于晓得，自己所修炼的功法中，为何会有“墨玉真灵诀”这种秘术，专门用来炼制真灵之血了。\n\n表面上，将真灵之血融合，会让修士本身的体质，获得一些好处。",
    "ai_word_count": 2006,
    "human_word_count": 2199
  }
}