{
  "chapter_title": "第七卷 纵横三界_第两千六百四十六章 玉石俱焚",
  "chapter_outline": [
    "白袍修士燃本命真元催动蛟龙器灵，先毁铜钱法宝，再令员外修士命悬一线。",
    "吴老怪以围魏救赵之势斧劈白袍修士，白袍修士视死如归、不闪不避，林轩暗中化解厉芒并现身。",
    "员外修士毙命，林轩以隐匿神通反讽吴老怪，救下白袍修士并稳住云隐宗人心。",
    "吴老怪自恃修为轻视林轩，抢先施展巨大术举斧劈落，战局在断章处引爆。"
  ],
  "truth_base": {
    "protagonist_plan": "林轩以本门长老身份护住白袍修士、震慑来犯群修，先以言语压服吴老怪；若其不退，便当场抽魂炼魄、杀鸡儆猴，稳住云隐宗总舵人心。",
    "antagonist_horizon": "吴老怪只凭林轩分神中期的表面修为和“偷袭”手段判断，认定他沽名钓誉、不敢正面一战，未察觉林轩的隐匿神通与真实战力。",
    "information_gap": "吴老怪不知林轩能无声无息化去开天辟地般的斧芒，更不知其实力远超表面境界；林轩则已看穿对方色厉内荏、盟友各怀心思。",
    "deadline": "白袍修士利刃加身、命悬一线；吴老怪的巨斧已夹开天辟地之威劈向林轩头顶，若不能瞬间立威，总舵人心与外敌合围之势将同时崩盘。"
  },
  "segments": {
    "opening": {
      "anchor_start": "尤其是那白袍修士，尽管脸色难看的要死，然而眼中却闪过一抹决然之色，双手一握，一道古怪的剑诀由他指尖浮现而出。",
      "anchor_end": "雾气一敛，一条长十余丈的蛟龙浮现于眼帘。",
      "text": "尤其是那白袍修士，尽管脸色难看的要死，然而眼中却闪过一抹决然之色，双手一握，一道古怪的剑诀由他指尖浮现而出。\n\n同时他张开口，从嘴巴里喷出一团血雾。\n\n此血可是蕴含得有本命真元在里头。\n\n此刻形势危急，白袍修士再无任何保留，准备拼命了。\n\n其本命法宝原本就辗转腾挪，颇有玄妙之处，此时此刻，更是灵光大做，仿若龙吟的声音传入耳朵，由那剑身中，喷薄出一片黑雾。\n\n雾气一敛，一条长十余丈的蛟龙浮现于眼帘。",
      "word_count": 200
    },
    "ramp_up": {
      "anchor_start": "器灵！",
      "anchor_end": "吴老怪惊怒交集，事情到了这一步，即便他修为远胜对方也来不及变招补救了。",
      "text": "器灵！\n\n“你这宝剑，居然是以蛟龙类妖兽作为器灵的？”\n\n那员外打扮的修士大惊失色，慌慌张张的操纵宝物想躲，可已经来不及了。\n\n只见那蛟龙两只利爪一合，居然将他那形如铜钱的法宝定在空中。\n\n随后乌光一闪，那仙剑狠狠的劈砍下来，借助器灵之力，居然将铜钱宝物劈成了两半。\n\n“噗……”\n\n员外打扮的修士一口鲜血喷薄，本命宝物被毁，心神牵动之下，不论是谁，都不会好过。\n\n而白袍修士得理不饶人，一道神念发出，顿时那蛟龙头颅一摆，像着受伤的员外飞了过来。\n\n“尔敢！”\n\n一声厉喝传入耳朵，那吴老怪又惊又怒，虽然他与这胖子员外并非同门，但好歹是盟友，对方居然当着自己的面杀人，这让自己的脸往哪儿搁。\n\n回去后非被耻笑不可。\n\n暴怒之下，他倒提双刃战斧，胳膊一抡，此宝就狠狠向下挥落。\n\n斧头仍在他的手里，然而随着这个动作，却是一道厉芒激射而出，亮丽无比，同时空间一阵扭曲，这一斧之威，仿佛要开天辟地，白袍修士若是不躲，下一刻就会身首异处。\n\n这是十分高明的围魏救赵之术。\n\n吴老怪的脸上挂着冷笑之色，然而接下来的一幕却让他惊呆了。\n\n对方居然不躲！\n\n有没有搞错，他不知道自己会被劈砍为两半么？\n\n疯了！\n\n这样的变故，以吴老怪斗法经验之丰富，也是始料未及的，修仙者中不乏勇猛之人，然而这样视死如归的家伙却是从未见过。\n\n利刃加身却不躲，想要一命换一命么？\n\n吴老怪惊怒交集，事情到了这一步，即便他修为远胜对方也来不及变招补救了。",
      "word_count": 611
    },
    "climax": {
      "core_conflict": "白袍修士以命换命的死斗逼出吴老怪围魏救赵，林轩暗中化斧现身；吴老怪受辱叫阵，反被林轩以隐匿神通和抽魂炼魄之言压制。",
      "anchor_start": "吴老怪惊怒交集，事情到了这一步，即便他修为远胜对方也来不及变招补救了。",
      "anchor_end": "但不管如何，此时见到林轩，自然是欣喜的成分更多，至于云隐宗其他的修士就更不用提，一个个喜形于色，仿佛找到了主心骨。",
      "text": "吴老怪惊怒交集，事情到了这一步，即便他修为远胜对方也来不及变招补救了。\n\n可恶！\n\n惊怒之下，他将更多的法力，注入身前的法宝里。\n\n对方既然不想活，那就如他所愿好了。\n\n吴老怪恶狠狠的想着，然而偏偏就在这时，异变突起，一声叹息，毫无征兆的传入耳里。\n\n同时，那由双刃巨斧劈刺而出的厉芒居然不见了。\n\n无声无息，被人轻松化解于无形。\n\n如此变故，不论是云隐宗的修仙者，还是那些外来的修士，一个二个，全都惊呆了。\n\n连那白袍修士也大感意外，他已心存死志，准备一命换一命，不曾想，居然有机会逃出生天。\n\n这运气，是不是太好了点。\n\n与此同时，却听见一声惨叫传入耳朵，那员外打扮的修士，可就没能得到上天的眷顾，被那蛟龙器灵将脖子扭断，一命呜呼。\n\n不过此刻，吴老怪已顾不得，他的面容上，全是惊疑与愤怒。\n\n“哪个宵小之辈隐在暗处偷袭，既然敢破本尊的法术，难道连正面一战的勇气也没有么？”\n\n吴老怪眼中闪过一丝狰狞之色，凶神恶煞的开口了，至于云隐宗其他的修仙者，他根本视若无睹。\n\n“偷袭？明明是阁下修为太低，看不破林某的隐匿神通而已，何况这里是云隐宗总舵，你们是什么东西，难道连阿猫阿狗，也可以来本门重地撒野不成么？”林轩的话轻描淡写，语气却充满了嘲讽之意。\n\n接着青光一闪，数十丈开外，一男一女显现出来，男的容貌平凡，女的则美丽而娇颜。\n\n正是林玉娇与林轩。\n\n刚才他飞遁到此处，见那白袍修士马上要血溅五步，林轩虽然与他不熟，但身为本门长老，当然不可能不管不顾，而以林轩的实力，化解同阶修士的这一击，根本就不费吹灰之力。\n\n“多谢师叔救我。”\n\n白袍修士抱拳行礼，脸上闪过一丝复杂之色，作为继任的天剑峰主，对于林轩，当然会有几分隔阂，自从天璇剑尊陨落，天剑峰弟子，在本门几乎抬不起头了。\n\n但不管如何，此时见到林轩，自然是欣喜的成分更多，至于云隐宗其他的修士就更不用提，一个个喜形于色，仿佛找到了主心骨。",
      "word_count": 799
    },
    "aftershock": {
      "anchor_start": "反观那些外来的家伙，则多少流露出几分紧张了。",
      "anchor_end": "话音未落，林轩袖袍，似乎要施展什么秘术，然而那吴老怪却抢先一步动手了，他嘴上满不在乎，然而内心深处，对林轩到底还是有几分忌惮的。",
      "text": "反观那些外来的家伙，则多少流露出几分紧张了。\n\n人的名，树的影。\n\n林轩虽然几乎没有怎么露面过，然而打败天绝老怪的事总不会是假的，由于时间的消磨，名气或许已淡了许多，但此刻出现在这里，那些家伙见了，心中多少还是有一些惧怕的。\n\n当然，也有例外者。\n\n比如说吴老怪就是一脸的倨傲之色：“你就是林轩？”\n\n“不错。”\n\n林轩的语气依旧是淡淡的：“阁下是准备自我了段呢，还是让林某代劳，先说好，若是选后者，恐怕难免会多吃不少苦头的，比如说，抽魂炼魄。”\n\n吴老怪听了此言一呆，随后怒极反笑起来：“自我了段，阁下还真敢说，你也不过区区分神中期的修士罢了，一个沽名钓誉之徒，也敢这样小视老夫，我看你是活得不耐烦了。”\n\n“沽名钓誉之徒，阁下这么认为的。”\n\n林轩的声音，依旧不带一点火气：“阁下说是就是吧，但不管如何，你先将小命儿留下再说。”\n\n话音未落，林轩袖袍，似乎要施展什么秘术，然而那吴老怪却抢先一步动手了，他嘴上满不在乎，然而内心深处，对林轩到底还是有几分忌惮的。",
      "word_count": 432
    },
    "cliffhanger": {
      "anchor_start": "话音未落，林轩袖袍，似乎要施展什么秘术，然而那吴老怪却抢先一步动手了，他嘴上满不在乎，然而内心深处，对林轩到底还是有几分忌惮的。",
      "anchor_end": "随后他两只胳膊一抡，寒光闪烁，那巨斧夹着开天辟地的威势，狠狠的像林轩头顶劈砍下去了。",
      "text": "话音未落，林轩袖袍，似乎要施展什么秘术，然而那吴老怪却抢先一步动手了，他嘴上满不在乎，然而内心深处，对林轩到底还是有几分忌惮的。\n\n吼！\n\n如同野兽咆哮般的声音传入耳朵，他的身体，一下子暴涨了十倍有余。\n\n巨大术！\n\n此人原本就身材壮实，此刻更如同巨人一般的威猛，而变大的不仅是他的身体，那双刃战斧也是一样地。\n\n随后他两只胳膊一抡，寒光闪烁，那巨斧夹着开天辟地的威势，狠狠的像林轩头顶劈砍下去了。",
      "word_count": 199
    }
  },
  "chapter_id": "ch_2649",
  "chapter_index": 2649,
  "prev_chapter_ending": "，加上其残忍嗜杀的性格，也就难怪云隐宗修士会四散而逃了。\n这样的选择，不能说有错，毕竟谁的小命都只有一次来着，问题是，即使跑，他们又跑得了么？\n原本敌人就数量众多，若是大家齐心合力，勉强还能周旋片刻，如今各自逃命，或许运气好的能够跑掉一两个，然而其他的家伙，就只有等着，被各个击破。\n这道理，云隐宗修士未必不是心里有数，然而却谁也没有勇气，去面对那吴老怪，当然，留下来的也有，但大部分都是被对手缠住，实在脱身不得，只有白袍修士等寥寥数人，才是毫无退避的意图，似乎准备豁出这条小命儿，与云隐宗共存亡了。",
  "contrast": {
    "prompt": "请根据以下大纲与上章承接，撰写一篇 2000~2500 字的完整小说章节：\n\n【章节标题】：第七卷 纵横三界_第两千六百四十六章 玉石俱焚\n【上一章结尾】：，加上其残忍嗜杀的性格，也就难怪云隐宗修士会四散而逃了。\n这样的选择，不能说有错，毕竟谁的小命都只有一次来着，问题是，即使跑，他们又跑得了么？\n原本敌人就数量众多，若是大家齐心合力，勉强还能周旋片刻，如今各自逃命，或许运气好的能够跑掉一两个，然而其他的家伙，就只有等着，被各个击破。\n这道理，云隐宗修士未必不是心里有数，然而却谁也没有勇气，去面对那吴老怪，当然，留下来的也有，但大部分都是被对手缠住，实在脱身不得，只有白袍修士等寥寥数人，才是毫无退避的意图，似乎准备豁出这条小命儿，与云隐宗共存亡了。\n【本章大纲】：\n1. 白袍修士燃本命真元催动蛟龙器灵，先毁铜钱法宝，再令员外修士命悬一线。\n2. 吴老怪以围魏救赵之势斧劈白袍修士，白袍修士视死如归、不闪不避，林轩暗中化解厉芒并现身。\n3. 员外修士毙命，林轩以隐匿神通反讽吴老怪，救下白袍修士并稳住云隐宗人心。\n4. 吴老怪自恃修为轻视林轩，抢先施展巨大术举斧劈落，战局在断章处引爆。\n\n【写作要求】：\n直接输出小说正文，保持情节连贯流畅，完成本章大纲所规划的所有情节走向。",
    "ai_draft": "白袍修士的嘴角，已经渗出了一缕血丝。\n\n那血色并不寻常，殷红之中泛着一丝暗金，像是被烈火反复灼烧过的铁屑。这是本命真元燃烧到极致的征兆。他双手掐诀，十指翻飞如蝶，每一道法诀落下，周身的气息便暴涨一分，而脸色，则苍白一分。\n\n“疯子！”\n\n有人低呼。可白袍修士充耳不闻。\n\n他身前那枚古朴的玉符轰然碎裂，碎屑化作点点流萤，尽数没入虚空。下一瞬，一声苍茫的龙吟自九天之上垂落，震得云层都散了开去。一条通体霜白的蛟龙虚影自他背后盘绕而出，鳞甲如刀，双目赤红，那是他以半身精血喂养了三百年的蛟龙器灵。\n\n器灵一出，四野气温骤降。\n\n“去！”\n\n白袍修士并指一点，霜白蛟龙便如离弦之箭，直扑那悬在半空的铜钱法宝。那法宝本是员外修士压箱底的依仗，九十九枚古钱串作一环，环环相扣，转动之间生出层层钱影，虚实难辨，最是阴毒，寻常法宝一沾便被绞成齑粉。\n\n可蛟龙器灵根本不辨虚实。它张口一吐，一口霜白寒气如瀑布倒卷，那九十九枚铜钱霎时凝上一层白霜，转动的速度肉眼可见地慢了下来。紧接着，龙尾横扫。\n\n“咔嚓——”\n\n一声脆响，像是冬日里踩碎了冰面。\n\n第一枚铜钱裂了。裂纹如蛛网般蔓延，眨眼间爬满整环。员外修士面色剧变，肥硕的身子猛地一震，张口便喷出一蓬血雾。那铜钱法宝与他心神相连，法宝一毁，他自然也受了重创。可他到底是个心狠的老手，咬牙不撤，反而催动残余的钱影，绕向白袍修士的后心。\n\n白袍修士眼也未抬。\n\n“爆。”\n\n他只吐出一个字。蛟龙器灵应声炸开半身寒光，将那残余钱影尽数吞没。铜钱法宝彻底崩解，漫天的碎铜如雨点坠落。而那条霜白蛟龙的余势未消，龙首一转，獠牙已咬至员外修士的咽喉。\n\n员外修士瞳孔骤缩。\n\n这一口若是咬实了，他便是有十条命,也要交代在这里。\n\n便在此时，一道凄厉的破空声自侧后方响起。\n\n那是一柄巨斧。\n\n斧身古朴，斧刃却亮得刺目，所过之处，空气都被硬生生劈成两半,留下一道久久不散的灰白痕迹。吴老怪出手了。他没有去救员外修士的正面,而是举斧直劈白袍修士的天灵盖。\n\n围魏救赵。\n\n这一斧的用意再明白不过：白袍修士若不回防，便要与员外修士同归于尽；若回防，蛟龙器灵便得撤回，员外修士自然脱身。\n\n这是阳谋，算准了人皆惜命。\n\n可白袍修士却笑了。\n\n那笑很淡，带着一点疲惫，一点解脱，还有一点近乎倔强的快意。他不闪，不避，甚至连眼皮都没抬一下，只是将最后一口本命真元尽数灌入蛟龙器灵，声音沙哑却平稳：“云隐宗……不能白白死这么多人。”\n\n巨斧当头落下。\n\n斧刃距离他额头，已不足三寸。\n\n就在这电光石火的一瞬，那道足以劈山断岳的厉芒，忽然诡异地一滞。\n\n像是撞上了一堵看不见的墙。斧芒先是一颤，继而从中裂开，无声无息地消散在半空，连一丝余波都未曾溢出。吴老怪脸色骤变，猛地抬头,眼中第一次露出了凝重。\n\n与此同时，员外修士的惨叫响彻云霄。\n\n蛟龙器灵的獠牙已然合拢。那肥硕的身躯僵在半空，胸前一个通透的血洞，铜钱碎屑从他指缝间簌簌落下。他张了张嘴，似想说什么，终究只吐出一口血沫，直挺挺地栽了下去，砸在地上，激起一片尘土。\n\n到死，他都没弄明白，那柄斧为何没能落下。\n\n“好一个围魏救赵。”\n\n一个清朗的声音，忽然在吴老怪身后三尺处响起。那声音不疾不徐，甚至带着几分笑意，可听在吴老怪耳中，却比方才的龙吟更叫他脊背发凉。\n\n他霍然转身。\n\n一个青衫青年，不知何时已立在那里，负手而立，神色从容，仿佛自始至终都站在此处看戏。风吹动他的衣角，却吹不散他周身那一层若有若无的淡淡虚影——那是隐匿神通催动到极致的迹象，连神识都难以锁定。\n\n“你……”\n\n“我什么？”林轩挑眉，“你是不是在想，这后生是什么时候来的，怎么一点声息都没有？”\n\n吴老怪瞳孔微缩。\n\n“我也想问问你，”林轩慢条斯理地踱了一步，恰好挡在白袍修士身前，“你堂堂一位成名老怪，杀一个燃了本命真元、连站都站不稳的人，还要用围魏救赵这种把戏，不觉得……跌份么？”\n\n此言一出，四下死寂。\n\n那些四散奔逃的云隐宗修士，不知何时竟陆续停住了脚步，纷纷回头望来。原本涣散的人心，像是被这句话硬生生拽了回来。白袍修士怔怔看着那道青衫背影，喉头动了动，终究没说出话，只是缓缓垂下了手。\n\n吴老怪的脸色，一寸寸沉了下去。\n\n他盯着林轩，神识如潮水般探出，反复扫过，最终却只探到一层深不见底的平静。这让他心头那点警惕，反倒被一股被冒犯的怒意压了下去。一个名不见经传的后辈，也敢在他面前如此放肆？\n\n“牙尖嘴利。”吴老怪冷笑，斧柄在掌心一转，那柄巨斧重新泛起森然寒光，“既然你急着替他们死，老夫便成全你。”\n\n话音未落，他已然抢先出手。\n\n这一斧与前番截然不同。吴老怪双臂一振，身形竟在刹那间拔高丈许，周身灰气翻涌，凝成一尊数丈高的巨大虚影，虚影手中同样握着一柄巨斧，斧刃直指苍穹。天地间的灵气被强行抽扯而来，汇成一道肉眼可见的漩涡。\n\n“开山——”\n\n巨斧高举，斧势尚未落下，方圆百丈的地面已先行龟裂，碎石浮空。\n\n林轩眯起眼睛，青衫猎猎，脚下却纹丝不动。\n\n“来得好。”",
    "human_original": "第七卷 纵横三界_第两千六百四十六章 玉石俱焚\n\n第两千六百四十六章\n\n玉石俱焚\n\n尤其是那白袍修士，尽管脸色难看的要死，然而眼中却闪过一抹决然之色，双手一握，一道古怪的剑诀由他指尖浮现而出。\n\n同时他张开口，从嘴巴里喷出一团血雾。\n\n此血可是蕴含得有本命真元在里头。\n\n此刻形势危急，白袍修士再无任何保留，准备拼命了。\n\n其本命法宝原本就辗转腾挪，颇有玄妙之处，此时此刻，更是灵光大做，仿若龙吟的声音传入耳朵，由那剑身中，喷薄出一片黑雾。\n\n雾气一敛，一条长十余丈的蛟龙浮现于眼帘。\n\n器灵！\n\n“你这宝剑，居然是以蛟龙类妖兽作为器灵的？”\n\n那员外打扮的修士大惊失色，慌慌张张的操纵宝物想躲，可已经来不及了。\n\n只见那蛟龙两只利爪一合，居然将他那形如铜钱的法宝定在空中。\n\n随后乌光一闪，那仙剑狠狠的劈砍下来，借助器灵之力，居然将铜钱宝物劈成了两半。\n\n“噗……”\n\n员外打扮的修士一口鲜血喷薄，本命宝物被毁，心神牵动之下，不论是谁，都不会好过。\n\n而白袍修士得理不饶人，一道神念发出，顿时那蛟龙头颅一摆，像着受伤的员外飞了过来。\n\n“尔敢！”\n\n一声厉喝传入耳朵，那吴老怪又惊又怒，虽然他与这胖子员外并非同门，但好歹是盟友，对方居然当着自己的面杀人，这让自己的脸往哪儿搁。\n\n回去后非被耻笑不可。\n\n暴怒之下，他倒提双刃战斧，胳膊一抡，此宝就狠狠向下挥落。\n\n斧头仍在他的手里，然而随着这个动作，却是一道厉芒激射而出，亮丽无比，同时空间一阵扭曲，这一斧之威，仿佛要开天辟地，白袍修士若是不躲，下一刻就会身首异处。\n\n这是十分高明的围魏救赵之术。\n\n吴老怪的脸上挂着冷笑之色，然而接下来的一幕却让他惊呆了。\n\n对方居然不躲！\n\n有没有搞错，他不知道自己会被劈砍为两半么？\n\n疯了！\n\n这样的变故，以吴老怪斗法经验之丰富，也是始料未及的，修仙者中不乏勇猛之人，然而这样视死如归的家伙却是从未见过。\n\n利刃加身却不躲，想要一命换一命么？\n\n吴老怪惊怒交集，事情到了这一步，即便他修为远胜对方也来不及变招补救了。\n\n可恶！\n\n惊怒之下，他将更多的法力，注入身前的法宝里。\n\n对方既然不想活，那就如他所愿好了。\n\n吴老怪恶狠狠的想着，然而偏偏就在这时，异变突起，一声叹息，毫无征兆的传入耳里。\n\n同时，那由双刃巨斧劈刺而出的厉芒居然不见了。\n\n无声无息，被人轻松化解于无形。\n\n如此变故，不论是云隐宗的修仙者，还是那些外来的修士，一个二个，全都惊呆了。\n\n连那白袍修士也大感意外，他已心存死志，准备一命换一命，不曾想，居然有机会逃出生天。\n\n这运气，是不是太好了点。\n\n与此同时，却听见一声惨叫传入耳朵，那员外打扮的修士，可就没能得到上天的眷顾，被那蛟龙器灵将脖子扭断，一命呜呼。\n\n不过此刻，吴老怪已顾不得，他的面容上，全是惊疑与愤怒。\n\n“哪个宵小之辈隐在暗处偷袭，既然敢破本尊的法术，难道连正面一战的勇气也没有么？”\n\n吴老怪眼中闪过一丝狰狞之色，凶神恶煞的开口了，至于云隐宗其他的修仙者，他根本视若无睹。\n\n“偷袭？明明是阁下修为太低，看不破林某的隐匿神通而已，何况这里是云隐宗总舵，你们是什么东西，难道连阿猫阿狗，也可以来本门重地撒野不成么？”林轩的话轻描淡写，语气却充满了嘲讽之意。\n\n接着青光一闪，数十丈开外，一男一女显现出来，男的容貌平凡，女的则美丽而娇颜。\n\n正是林玉娇与林轩。\n\n刚才他飞遁到此处，见那白袍修士马上要血溅五步，林轩虽然与他不熟，但身为本门长老，当然不可能不管不顾，而以林轩的实力，化解同阶修士的这一击，根本就不费吹灰之力。\n\n“多谢师叔救我。”\n\n白袍修士抱拳行礼，脸上闪过一丝复杂之色，作为继任的天剑峰主，对于林轩，当然会有几分隔阂，自从天璇剑尊陨落，天剑峰弟子，在本门几乎抬不起头了。\n\n但不管如何，此时见到林轩，自然是欣喜的成分更多，至于云隐宗其他的修士就更不用提，一个个喜形于色，仿佛找到了主心骨。\n\n反观那些外来的家伙，则多少流露出几分紧张了。\n\n人的名，树的影。\n\n林轩虽然几乎没有怎么露面过，然而打败天绝老怪的事总不会是假的，由于时间的消磨，名气或许已淡了许多，但此刻出现在这里，那些家伙见了，心中多少还是有一些惧怕的。\n\n当然，也有例外者。\n\n比如说吴老怪就是一脸的倨傲之色：“你就是林轩？”\n\n“不错。”\n\n林轩的语气依旧是淡淡的：“阁下是准备自我了段呢，还是让林某代劳，先说好，若是选后者，恐怕难免会多吃不少苦头的，比如说，抽魂炼魄。”\n\n吴老怪听了此言一呆，随后怒极反笑起来：“自我了段，阁下还真敢说，你也不过区区分神中期的修士罢了，一个沽名钓誉之徒，也敢这样小视老夫，我看你是活得不耐烦了。”\n\n“沽名钓誉之徒，阁下这么认为的。”\n\n林轩的声音，依旧不带一点火气：“阁下说是就是吧，但不管如何，你先将小命儿留下再说。”\n\n话音未落，林轩袖袍，似乎要施展什么秘术，然而那吴老怪却抢先一步动手了，他嘴上满不在乎，然而内心深处，对林轩到底还是有几分忌惮的。\n\n吼！\n\n如同野兽咆哮般的声音传入耳朵，他的身体，一下子暴涨了十倍有余。\n\n巨大术！\n\n此人原本就身材壮实，此刻更如同巨人一般的威猛，而变大的不仅是他的身体，那双刃战斧也是一样地。\n\n随后他两只胳膊一抡，寒光闪烁，那巨斧夹着开天辟地的威势，狠狠的像林轩头顶劈砍下去了。",
    "ai_word_count": 2061,
    "human_word_count": 2188
  }
}