{
  "chapter_title": "第五卷 天云十二州_第一千四百零一章 百年相见",
  "chapter_outline": [
    "林轩携叶瓶儿返回拜轩阁总舵，守山弟子不识其真实身份，郑璇当值认出师祖。",
    "月儿闻讯飞出天机府，与爱徒郑璇百年重逢，当众相拥痛哭，林轩宽容免礼。",
    "林轩入大殿受陆盈儿、武云儿侍奉，得知二女已至凝丹后期，并准备听取宗门百年近况。",
    "画面切至魔域洞府，田小剑在风良威压下答应魔气灌体，并被要求封闭灵识与浑身法力。"
  ],
  "truth_base": {
    "protagonist_plan": "林轩以离合期修为归返拜轩阁总舵，确认陆盈儿、武云儿、月儿等旧人与宗门百年近况，稳固后方根基，再图天云十二州大局。",
    "antagonist_horizon": "守山弟子与郑璇起初只当来者是元婴前辈，不知其已进阶离合；田小剑则把风良的魔气灌体视为高风险机缘，误信“八成把握”，未看透封闭灵识法力背后的杀机。",
    "information_gap": "林轩真实修为与太上长老身份对普通门人形成认知落差；风良口中“八成把握”与“封闭灵识法力”的真实目的未明，田小剑和读者都被留在信息黑箱前。",
    "deadline": "风良耐心将尽，田小剑已答应魔气灌体，下一步必须立刻封闭灵识与浑身法力，生死成败迫在眉睫。"
  },
  "segments": {
    "opening": {
      "anchor_start": "“咦，是那丫头。”",
      "anchor_end": "为首的是一妙龄少女，身材高挑，容颜美丽，从姿色来说，比叶瓶儿还胜上一筹，虽不能堪称绝色，但也担当得起明眸皓齿几个字的形容。",
      "text": "“咦，是那丫头。”\n\n进阶离合以后，林轩不止修为暴增了许多，听觉视力同样大大增强了。\n\n目光在那几道飞遁而来的惊虹上扫过，脸上露出大感意外之色，没想到才回到拜轩阁总舵，就与熟人重逢，今天是那小丫头当值么？\n\n脑海中念头闪过，那几道遁光也来到眼前了。\n\n为首的是一妙龄少女，身材高挑，容颜美丽，从姿色来说，比叶瓶儿还胜上一筹，虽不能堪称绝色，但也担当得起明眸皓齿几个字的形容。",
      "word_count": 187
    },
    "ramp_up": {
      "anchor_start": "“参见师叔。”",
      "anchor_end": "“师……师尊？”",
      "text": "“参见师叔。”\n\n两名当值的修士忙抱拳拜下去了，对方虽然仅仅是凝丹初期的修仙者，但在拜轩阁的权势，还远在几名长老之上的。\n\n听说即使见到两位阁主，也是以姐姐称呼。\n\n“刚才是你俩发来的传音符，说有人……”\n\n少女话音未落，声音突然嘎然而止了，目光落像林轩的面容，美眸中闪过不能置信之色，声音甚至都有些颤抖。\n\n“师祖，您……您回来了？”\n\n不用说，此女正是月儿的爱徒。\n\n林轩的表情顿时也温和下来了，所谓爱屋及乌，正欲开口与此女打招呼，月儿却如一阵风般的飞出了天机府。\n\n两女可是非常投缘的，名为师徒，其实好得与姐妹差不多。\n\n“璇儿，是妳么？”小丫头也没想到如此快，就遇见了爱徒，这一别就是百年之久，当然有满腹的话想说。\n\n“师……师尊？”",
      "word_count": 321
    },
    "climax": {
      "core_conflict": "百年师徒重逢的情绪决堤与宗门尊卑礼法相撞；郑璇当众抱住月儿痛哭，林轩以宽容免礼化解失态，完成情感爆发后的秩序复位。",
      "anchor_start": "“师……师尊？”",
      "anchor_end": "“不用多礼。”",
      "text": "“师……师尊？”\n\n郑璇一愕，脸上更是露出狂喜之色，与别的师徒见面行礼不同，这丫头居然是如旋风般冲过来，将月儿抱住：“师尊，我……我终于又见到妳了。”\n\n话音未落，便嘤嘤的哭起来了。\n\n林轩也不由得一阵无语，此女好歹也是凝丹期修士，却当着晚辈放声大哭，也不怕被晚辈们笑话。\n\n林轩也算是见识广博，这种情景却真没有遇到过，一时片刻，也不知道该如何是好了。\n\n足足过了一盏茶的功夫，郑璇才想起师祖还在旁边等着，脸上露出不好意思之色，冲林轩盈盈一拂：“对不起，师祖，璇儿太失礼了。”\n\n“没什么。”\n\n林轩笑着摆了摆手，自然不会为这点小事就见怪什么。\n\n“多谢师祖。”郑璇脸上露出甜甜的笑容，随后将娇躯转过，冲着一旁的修士呵斥起来了：“都愣着干什么，还不快给太上长老见礼。”\n\n话音未落，她玉手一拂，也发出了一道传音符。\n\n“什么，眼前之人就是太上长老？”\n\n众修士大惊失色，林轩虽是拜轩阁幕后真正的主人，但宗门事物，一直是由陆盈儿三女打理的，见过他的人屈指可数，一般修士都是只闻其名而已，不过倒没有人怀疑郑璇的言语，纷纷屈膝跪了下去。\n\n“不用多礼。”",
      "word_count": 474
    },
    "aftershock": {
      "anchor_start": "林轩话音未落，远处，隐隐有遁光映入了眼帘中。",
      "anchor_end": "“师傅，徒弟愿意按你的建议去做，不过你没有骗我，真的有八成把握？”田小剑缓缓的开口了。",
      "text": "林轩话音未落，远处，隐隐有遁光映入了眼帘中。\n\n……\n\n小半个时辰以后，林轩被迎入了一美轮美奂的大殿里，虽然与天涯海阁相比，还远远不及，但其华丽程度，却已胜过世俗的皇宫倍许。\n\n大殿中仅有三人而已。一男两女。不用说，自然是林轩与两位拜轩阁的阁主。连月儿都不在天机府，小丫头去了宝贝徒弟的洞府，说悄悄话去了。叶瓶儿才刚刚入门而已，林轩也让人将她带了下去。\n\n“少爷，请喝。”陆盈儿亲手为林轩沏了一壶茶，百年未见，此女大方如昔，却比以前更加的善解人意。武云儿的脸上也满是笑意，两人如今都已进阶到凝丹后期。\n\n“少爷进阶离合，小婢在这里恭喜你了。”陆盈儿盈盈一福，脸上带着由衷的喜色。\n\n“好了，都是自己人，妳们两个丫头又何需拍马屁呢，给我说说，现在拜轩阁情形如何？”林轩喝了一口茶，声音平淡的开口了。\n\n“是，少爷。”陆盈儿低垂臻首，理了理发丝，樱唇微启：“自从百年前，您离开此处……”\n\n再说另一边，距此千万里之外。天州，魔域山脉。群山深处，某阴森晦暗的洞府。\n\n“这么说，你已经想明白了？”忽男忽女的声音传入耳朵，风良妖异的容貌上带着几分兴奋之色。\n\n“是的，师傅。”田小剑点了点头，脸色坚定的开口。经过数日的思索，他终于答应对方魔气灌体的建议了。\n\n可时不待我，风良表面上说让他考虑，可随着时间的推移，这老怪物的脾气却变得暴躁以极。这家伙的性格，本来就乖张狠厉，人在屋檐下，不得不低头，田小剑也不敢真的将他激怒，否则天知道这老怪物发起疯来，会不会将自己给灭了。\n\n通过一番利弊权衡之后，田小剑决定赌一赌。\n\n“师傅，徒弟愿意按你的建议去做，不过你没有骗我，真的有八成把握？”田小剑缓缓的开口了。",
      "word_count": 698
    },
    "cliffhanger": {
      "anchor_start": "“师傅，徒弟愿意按你的建议去做，不过你没有骗我，真的有八成把握？”田小剑缓缓的开口了。",
      "anchor_end": "“很简单，你只要将灵识与浑身的法力暂且封闭就行了。”",
      "text": "“师傅，徒弟愿意按你的建议去做，不过你没有骗我，真的有八成把握？”田小剑缓缓的开口了。\n\n“哼，你小子资质优异，就是性格太过多疑，本尊又岂会在这样的事情上骗你，你死了，对我又何好处？”风良冷冷的开口了。\n\n这话倒也不错，至少田小剑仔细琢磨，也没有从中找出什么漏洞。\n\n“好，那请问徒儿该这么做？”\n\n“很简单，你只要将灵识与浑身的法力暂且封闭就行了。”",
      "word_count": 176
    }
  },
  "chapter_id": "ch_1404",
  "chapter_index": 1404,
  "prev_chapter_ending": "刹那，两人发现此女低眉顺目，一副唯那少年马首是瞻的样子。\n人不可貌相，海水不可斗量，不用说，这男子的修为还要更高一些。\n十有八九真是元婴修士。\n“给前辈见礼，不知道前辈驾临我拜轩阁，可是有什么要事？”那吕姓修士忙抱拳深施一礼，脸上满是恭敬之意。\n年轻人反应过来，也忙躬身下拜。\n林轩却没有开口，而是将神识放出，距离上次离开已是百年之久，不过景物依旧，就不知道几个丫头如今怎么样了？\n林轩不开口，叶瓶儿自然也乖乖的保持沉默，两个守山门的弟子一呆，脸色都有些难看起来。\n而就在这时，又有几道遁光映入眼帘。",
  "contrast": {
    "prompt": "请根据以下大纲与上章承接，撰写一篇 2000~2500 字的完整小说章节：\n\n【章节标题】：第五卷 天云十二州_第一千四百零一章 百年相见\n【上一章结尾】：刹那，两人发现此女低眉顺目，一副唯那少年马首是瞻的样子。\n人不可貌相，海水不可斗量，不用说，这男子的修为还要更高一些。\n十有八九真是元婴修士。\n“给前辈见礼，不知道前辈驾临我拜轩阁，可是有什么要事？”那吕姓修士忙抱拳深施一礼，脸上满是恭敬之意。\n年轻人反应过来，也忙躬身下拜。\n林轩却没有开口，而是将神识放出，距离上次离开已是百年之久，不过景物依旧，就不知道几个丫头如今怎么样了？\n林轩不开口，叶瓶儿自然也乖乖的保持沉默，两个守山门的弟子一呆，脸色都有些难看起来。\n而就在这时，又有几道遁光映入眼帘。\n【本章大纲】：\n1. 林轩携叶瓶儿返回拜轩阁总舵，守山弟子不识其真实身份，郑璇当值认出师祖。\n2. 月儿闻讯飞出天机府，与爱徒郑璇百年重逢，当众相拥痛哭，林轩宽容免礼。\n3. 林轩入大殿受陆盈儿、武云儿侍奉，得知二女已至凝丹后期，并准备听取宗门百年近况。\n4. 画面切至魔域洞府，田小剑在风良威压下答应魔气灌体，并被要求封闭灵识与浑身法力。\n\n【写作要求】：\n直接输出小说正文，保持情节连贯流畅，完成本章大纲所规划的所有情节走向。",
    "ai_draft": "## 第五卷 天云十二州_第一千四百零一章 百年相见\n\n几道遁光由远及近，落在山门之前，现出三名身着拜轩阁内门服饰的修士。为首一人须发花白，气息沉稳，已是凝丹中期的修为，目光一扫，便落在林轩与叶瓶儿身上，眉头微不可察地一皱。\n\n“吕师弟，这是怎么回事？”他沉声问道。\n\n那吕姓修士连忙上前，压低声音道：“师兄，这两位……弟子看不透，十有八九是元婴前辈。”\n\n花白须发的修士神色一凛，当即整了整衣袍，正要上前见礼，却听身后传来一声清脆而急促的喝声：“都住手！”\n\n众人回头，只见一名身着青白执法袍的女修正快步而来。她眉目清秀，气质冷峻，腰间悬着一枚拜轩阁执法弟子的令牌，正是今日当值的郑璇。\n\n郑璇原本只是例行巡视山门，远远看见几名弟子围在一处，本欲出言训斥，可当她的目光越过人群，落在那名负手而立的青衫年轻人脸上时，整个人骤然僵住。\n\n那张脸，她在画像上见过无数次。天机府正殿之中，悬挂着一幅师祖亲笔所绘的画像，阁中核心弟子每月都要焚香瞻仰。百余年来，画像上的人从未变过，眉眼清淡，神情温和，仿佛随时会从画中走出来。\n\n此刻，那人就站在山门前，与画像上一模一样，甚至连唇角那一点若有若无的笑意都分毫不差。\n\n郑璇的呼吸猛地一滞，膝盖一软，竟当场跪了下去，声音发颤：“弟子郑璇，拜见师祖！”\n\n此言一出，山门前霎时死寂。\n\n吕姓修士与那花白须发的修士面面相觑，脑中“嗡”的一声。师祖？拜轩阁的师祖，还能是哪一位？那个百余年前以一己之力开辟天云十二州商路、令拜轩阁从一个边陲小阁一跃成为十二州巨擘的传奇人物——林轩！\n\n“弟子……弟子有眼无珠！”吕姓修士“扑通”一声跪倒，额头几乎贴到地面，冷汗瞬间浸透了后背。他方才还在心中揣度对方来意，甚至还隐隐有些不耐，此刻只觉一颗心要从嗓子眼里跳出来。\n\n林轩这才收回远眺的目光，看向跪在地上的郑璇，微微颔首：“起来吧。你师父……月儿可还在阁中？”\n\n郑璇强压着激动，起身答道：“回师祖，师父她老人家一直在天机府闭关参悟，弟子这就去通禀！”\n\n“不必。”林轩摆了摆手，“我自己……”\n\n话音未落，远处天机府方向骤然亮起一道璀璨的银光。那银光来得极快，初时还在天际，眨眼间便已掠过重重殿宇，带着一股压抑不住的磅礴灵压，直冲山门而来。\n\n银光散去，现出一道窈窕身影。\n\n她一袭月白长裙，容颜清丽如旧，只是眉眼之间比百年前多了几分沉静与威仪。那双眼睛死死盯着山门前的青衫身影，先是难以置信，继而眼眶一寸寸泛红，最后两行清泪无声滑落。\n\n“师尊……”\n\n月儿的声音很轻，轻得像怕惊碎一场梦。\n\n林轩看着她，目光柔和下来，轻轻“嗯”了一声。\n\n这一声“嗯”，仿佛抽去了月儿所有的力气。她身形一晃，竟不顾身份，不顾仪态，当着山门数十名弟子的面，飞扑过去，一头撞进林轩怀里，双臂死死环住他的腰，放声大哭。\n\n“师尊！您终于回来了……一百年，整整一百年啊……”\n\n哭声撕心裂肺，哪还有半分天机府主事者的威严。周围的拜轩阁弟子一个个目瞪口呆，谁也不敢出声。郑璇站在一旁，眼圈也跟着红了，悄悄别过头去。\n\n林轩抬手，轻轻拍了拍月儿的后背，语气里带着几分无奈，几分歉疚：“好了，都这么大了，还哭鼻子。让人看见，成何体统。”\n\n“我不管！”月儿埋在他怀里，声音闷闷的，带着哭腔，“师尊要是再晚回来几年，月儿就……就……”\n\n“就什么？”\n\n“就不理你了！”\n\n林轩失笑，摇了摇头：“我这不是回来了么。”\n\n叶瓶儿站在一旁，看着这一幕，唇角微微翘起，倒也没有半分不悦，只是安安静静地等着。\n\n好半晌，月儿才渐渐止住哭声，从林轩怀里退开，胡乱抹了把脸，这才注意到旁边的叶瓶儿，脸颊微微一红，却还是规规矩矩地行了一礼：“叶姐姐。”\n\n叶瓶儿笑着扶起她：“百年不见，月儿妹妹越发能干了。”\n\n月儿被她一夸，反倒有些不好意思，转头瞪了郑璇一眼：“你这丫头，师祖回来了，怎么不早些传讯给我？”\n\n郑璇委屈道：“师父，弟子也是刚刚才认出来……”\n\n林轩摆了摆手：“不必怪她。我回来得突然，本就没想惊动什么人。”\n\n他环顾四周，看着跪了一地的弟子，淡淡道：“都起来吧，不必多礼。我离开百年，阁中规矩倒是越发严了。”\n\n众弟子如蒙大赦，纷纷起身，却仍旧垂手而立，大气都不敢喘。\n\n月儿这才想起正事，忙道：“师尊，快请入殿。盈儿和云儿要是知道您回来了，不知要高兴成什么样。”\n\n一行人往大殿而去。沿途弟子纷纷驻足行礼，消息像长了翅膀一样飞快传开。等林轩踏入正殿时，殿中已经候着两名女子。\n\n左边一人身着鹅黄衣裙，身姿丰腴，面若桃花，正是陆盈儿；右边一人一身素净白衣，气质清冷，眉宇间透着一股英气，却是武云儿。两人一见林轩，齐齐上前，一个捧茶，一个奉座，动作娴熟自然，显然早已习惯。\n\n“师尊请用茶。”陆盈儿眼波流转，声音软糯。\n\n“师尊一路辛苦。”武云儿将座椅拂了又拂，才退到一旁。\n\n林轩接过茶盏，目光在二女身上一掠，不由微微点头：“不错，都到凝丹后期了，根基还很扎实。”\n\n陆盈儿闻言一喜，掩唇笑道：“师尊一走百年，我和云儿姐姐可没敢偷懒。只是……再往上一步就难了，这些年生生的卡在这里。”\n\n武云儿也道：“凝婴之事，我和盈儿妹妹始终摸不到门径，还请师尊指点。”\n\n“急什么。”林轩呷了口茶，“凝婴不是闭门苦修就能成的，机缘、心境、丹药，缺一不可。我既然回来了，自然会替你们谋划。”\n\n二女对视一眼，皆是喜形于色。\n\n林轩放下茶盏，神色转为正色：“好了，闲话少说。月儿，这百年里，阁中可有什么大事？天云十二州的格局，可有什么变化？”\n\n月儿早已收敛了方才的失态，闻言神情一肃，在他下首坐了，缓缓道：“回师尊，阁中倒是一切安好。十二州商路已经彻底铺开，各州坊市都有我们的据点，每年进项比百年前翻了数倍。只是……”\n\n她顿了顿，眉宇间浮起一丝忧色：“最近一年，魔域那边动静不小，有几处边州坊市接连出事，弟子派人去查，却都石沉大海。弟子怀疑，魔域之中，怕是出了什么变故。”\n\n林轩端着茶盏的手微微一顿，眼中掠过一道精光。\n\n与此同时，遥远的天云十二州之外，一片终年被黑雾笼罩的魔域深处。\n\n幽暗的洞府中，阴冷的魔气如潮水般涌动，凝聚成一张模糊的人脸，居高临下地俯视着石台上的黑衣青年。\n\n田小剑单膝跪地，浑身颤抖，牙关咬得咯咯作响。\n\n“风良……你当真要如此？”\n\n那魔气凝成的人脸发出沙哑的笑声：“小子，这是你唯一的机会。魔气灌体，一步登天。你只需封闭灵识，散去浑身法力，乖乖受着便是。”\n\n田小剑低下头，眼底深处闪过一丝挣扎，许久，终于从牙缝里挤出两个字：“……好。”",
    "human_original": "第五卷 天云十二州_第一千四百零一章 百年相见\n\n第一千四百零一章\n\n百年相见\n\n“咦，是那丫头。”\n\n进阶离合以后，林轩不止修为暴增了许多，听觉视力同样大大增强了。\n\n目光在那几道飞遁而来的惊虹上扫过，脸上露出大感意外之色，没想到才回到拜轩阁总舵，就与熟人重逢，今天是那小丫头当值么？\n\n脑海中念头闪过，那几道遁光也来到眼前了。\n\n为首的是一妙龄少女，身材高挑，容颜美丽，从姿色来说，比叶瓶儿还胜上一筹，虽不能堪称绝色，但也担当得起明眸皓齿几个字的形容。\n\n“参见师叔。”\n\n两名当值的修士忙抱拳拜下去了，对方虽然仅仅是凝丹初期的修仙者，但在拜轩阁的权势，还远在几名长老之上的。\n\n听说即使见到两位阁主，也是以姐姐称呼。\n\n“刚才是你俩发来的传音符，说有人……”\n\n少女话音未落，声音突然嘎然而止了，目光落像林轩的面容，美眸中闪过不能置信之色，声音甚至都有些颤抖。\n\n“师祖，您……您回来了？”\n\n不用说，此女正是月儿的爱徒。\n\n林轩的表情顿时也温和下来了，所谓爱屋及乌，正欲开口与此女打招呼，月儿却如一阵风般的飞出了天机府。\n\n两女可是非常投缘的，名为师徒，其实好得与姐妹差不多。\n\n“璇儿，是妳么？”小丫头也没想到如此快，就遇见了爱徒，这一别就是百年之久，当然有满腹的话想说。\n\n“师……师尊？”\n\n郑璇一愕，脸上更是露出狂喜之色，与别的师徒见面行礼不同，这丫头居然是如旋风般冲过来，将月儿抱住：“师尊，我……我终于又见到妳了。”\n\n话音未落，便嘤嘤的哭起来了。\n\n林轩也不由得一阵无语，此女好歹也是凝丹期修士，却当着晚辈放声大哭，也不怕被晚辈们笑话。\n\n林轩也算是见识广博，这种情景却真没有遇到过，一时片刻，也不知道该如何是好了。\n\n足足过了一盏茶的功夫，郑璇才想起师祖还在旁边等着，脸上露出不好意思之色，冲林轩盈盈一拂：“对不起，师祖，璇儿太失礼了。”\n\n“没什么。”\n\n林轩笑着摆了摆手，自然不会为这点小事就见怪什么。\n\n“多谢师祖。”郑璇脸上露出甜甜的笑容，随后将娇躯转过，冲着一旁的修士呵斥起来了：“都愣着干什么，还不快给太上长老见礼。”\n\n话音未落，她玉手一拂，也发出了一道传音符。\n\n“什么，眼前之人就是太上长老？”\n\n众修士大惊失色，林轩虽是拜轩阁幕后真正的主人，但宗门事物，一直是由陆盈儿三女打理的，见过他的人屈指可数，一般修士都是只闻其名而已，不过倒没有人怀疑郑璇的言语，纷纷屈膝跪了下去。\n\n“不用多礼。”\n\n林轩话音未落，远处，隐隐有遁光映入了眼帘中。\n\n……\n\n小半个时辰以后，林轩被迎入了一美轮美奂的大殿里，虽然与天涯海阁相比，还远远不及，但其华丽程度，却已胜过世俗的皇宫倍许。\n\n大殿中仅有三人而已。\n\n一男两女。\n\n不用说，自然是林轩与两位拜轩阁的阁主。\n\n连月儿都不在天机府，小丫头去了宝贝徒弟的洞府，说悄悄话去了。\n\n叶瓶儿才刚刚入门而已，林轩也让人将她带了下去。\n\n“少爷，请喝。”\n\n陆盈儿亲手为林轩沏了一壶茶，百年未见，此女大方如昔，却比以前更加的善解人意。\n\n武云儿的脸上也满是笑意，两人如今都已进阶到凝丹后期。\n\n相对来说，云儿资质要好一些，修为还有胜上一筹，已经非常接近凝丹期顶峰。\n\n大概月余以前，从天涯海阁使者的口里，得知了林轩的消息，两女自是又惊又喜，不过亲眼相见以后，才总算是松了一口气。\n\n“少爷进阶离合，小婢在这里恭喜你了。”陆盈儿盈盈一福，脸上带着由衷的喜色。\n\n“不错，师伯才三百余岁年纪，就能迈入传说中的离合，前无古人，后无来者，我相信您一定能够更进一步，飞升到灵界去的。”清脆的声音传入耳朵，武云儿说话，还是那么的让人听了心中舒服。\n\n“好了，都是自己人，妳们两个丫头又何需拍马屁呢，给我说说，现在拜轩阁情形如何？”林轩喝了一口茶，声音平淡的开口了。\n\n“是，少爷。”陆盈儿低垂臻首，理了理发丝，樱唇微启：“自从百年前，您离开此处……”\n\n再说另一边，距此千万里之外。\n\n天州，魔域山脉。\n\n群山深处，某阴森晦暗的洞府。\n\n“这么说，你已经想明白了？”忽男忽女的声音传入耳朵，风良妖异的容貌上带着几分兴奋之色。\n\n“是的，师傅。”\n\n田小剑点了点头，脸色坚定的开口。\n\n经过数日的思索，他终于答应对方魔气灌体的建议了。\n\n而做出这样的选择，当然也是有理由的，其实以田小剑沉稳狠厉的性子，倒不是受不了离合期的诱惑，从本意来说，他也是想一步一个脚印，先打下坚实的基础，再慢慢晋级的。\n\n可时不待我，风良表面上说让他考虑，可随着时间的推移，这老怪物的脾气却变得暴躁以极。\n\n这家伙的性格，本来就乖张狠厉，人在屋檐下，不得不低头，田小剑也不敢真的将他激怒，否则天知道这老怪物发起疯来，会不会将自己给灭了。\n\n与其死在他的手里，不如搏一搏，魔气灌体虽然危险，但也是有机会成功。\n\n不入虎穴焉得虎子，说不定自己真的可以进阶离合……\n\n通过一番利弊权衡之后，田小剑决定赌一赌。\n\n“师傅，徒弟愿意按你的建议去做，不过你没有骗我，真的有八成把握？”田小剑缓缓的开口了。\n\n“哼，你小子资质优异，就是性格太过多疑，本尊又岂会在这样的事情上骗你，你死了，对我又何好处？”风良冷冷的开口了。\n\n这话倒也不错，至少田小剑仔细琢磨，也没有从中找出什么漏洞。\n\n“好，那请问徒儿该这么做？”\n\n“很简单，你只要将灵识与浑身的法力暂且封闭就行了。”",
    "ai_word_count": 2681,
    "human_word_count": 2196
  }
}