{
  "chapter_title": "第七卷 纵横三界_第两千二百一十四章 荒芜冰原",
  "chapter_outline": [
    "鼐龙界天霜郡北部荒芜冰原，两伙寻宝修士因一株紫罗草相遇，争执升级为死斗",
    "黑袍元婴后期执法使降临，以“方圆二十万里禁区、擅闯者杀无赦”为名，将两伙修士尽数灭杀",
    "揭示禁区真相：冰原深处藏有通往魔界的空间节点，正值衰弱期显踪，各大势力派执法使联手清场",
    "执法使摘草入怀后察觉天边灵舟，误判来者不值一提，冷笑迎上，灵舟上却是一男一女，杀机骤然逼临"
  ],
  "truth_base": {
    "protagonist_plan": "林轩与蒙面女子乘简陋灵舟低调穿行冰原，意在悄然借道通往魔界的空间节点，前往古魔界谋取分神试炼名额，算盘是避人耳目、不惹是非",
    "antagonist_horizon": "中年执法使以座驾简陋、距离过远无法感知境界为据，笃定灵舟上的一男一女不值一提，视之为顺手可灭的漏网生灵，主动迎上",
    "information_gap": "执法使不知灵舟上的平凡青年实为林轩，修为远在其元婴后期之上；林轩一方也未必知晓此地已被几大势力封为二十万里禁区、擅闯即死",
    "deadline": "空间节点衰弱期已至、异象显踪，二十万里禁区完成清场，执法使正面迎来，杀机一触即发"
  },
  "segments": {
    "opening": {
      "anchor_start": "作为灵界屈指可数的顶级界面之一，鼐龙界的面积辽阔无比，共分为九九八十一个郡府。",
      "anchor_end": "万年不腐，从来就不曾融化过。",
      "text": "作为灵界屈指可数的顶级界面之一，鼐龙界的面积辽阔无比，共分为九九八十一个郡府。\n每一个郡的面积那也是相当辽阔，恐怕比东海修仙界也差不了许多。\n换句话说，别的资源暂且不提，鼐龙界光是面积，就将近东海百倍有余。\n这么广袤的面积，当然难免会有不毛之地。\n比如在天霜郡的北部，就有一片冰原，广袤无边，终年皆有鹅毛大雪飘落，寒冰厚达千丈有余，万年不腐，从来就不曾融化过。",
      "word_count": 180
    },
    "ramp_up": {
      "anchor_start": "这一片冰原别说凡人，就算是修仙者与妖族，也很少有人会到此处，气候实在是太恶劣了，这里不仅寒冷，而且灵气非常的稀薄。",
      "anchor_end": "“你们要听从本尊的吩咐，那好，就将小命留在此处。”那中年人脸上带着一丝狞笑的开口了。",
      "text": "这一片冰原别说凡人，就算是修仙者与妖族，也很少有人会到此处，气候实在是太恶劣了，这里不仅寒冷，而且灵气非常的稀薄。\n这是一个平静的早晨，太阳才刚刚初升，鹅毛般的大雪依旧从天空中飘落，阳光洒落，却没有一点温度，冷冷的。\n轰！\n爆裂声传入耳朵，将这份宁静给狠狠的撕破。\n只见远处的天空之中，一道红芒，一道黑气纵横捭阖，正不停的缠斗着。\n这片冰原虽是人迹罕至之所，但并不代表就一名修仙者都不会来了。\n尽管牠的灵气稀薄，尽管牠的条件恶劣到极处。\n可那又如何，大自然自有牠的规律，在这样的地方，反而有几位灵药适合生长。\n因为这个缘故，偶尔也会有修士来到此处，去寻找那发财机会的。\n要知道这种灵药殊为难得，采摘到一棵，拿到拍卖会中，就可以卖出天价来着。\n天下熙熙，皆为利往。\n即使是这样的不毛之所，也可以看见寻宝修士踪迹的。\n可惜这片冰原实在太大了，虽然没有强大的妖兽出没，但想要找到一颗灵药，也不知道需花费多少功夫。\n常常十年八年，也不一定有收获。\n偏偏今天却有这样的巧合，两伙寻宝修士迎面相遇了。\n原本这也没有什么，大路朝天，各走一边，双方的实力相差仿佛，自然不会有谁心存歹念。\n按理说，这意外的重逢，不应该有什么波折，大家打一个招呼，就该各奔东西了。\n可巧就巧在，他们相遇的地点，有一颗珍贵的灵物。\n紫罗草！\n或许在林轩这样的眼里，此物不值一提，然而对凝丹期修士来说，却是可遇而不可求的宝物，足够让他们修到元婴期也不用担心晶石的来源了。\n这样的宝物，谁肯相让呢？\n两伙寻宝修士立刻就起了争执，说是自己先看见的这件宝物。\n其实这根本就丝毫意义也无，谁先看见的又怎么样呢？\n归根结底，还是要看实力，于是在吵闹一番之后，双方开始大打出手。\n不死不休！\n两伙寻宝修士的实力相差仿佛。\n领头的都是凝丹后期的修仙者，除此以外，都是初期与中期的修士，还有筑基期的子侄。\n人数也相近，一时之间，打得是激烈无比，短时间内，却难以分出胜负。\n转眼，已是小半个时辰过去了，双方皆陨落了不少人手，却没有人愿意就此退后。\n然而就在此刻，天边突然飞来了一抹亮丽的惊虹。\n开始尚远，然而速度极快，不过一眨眼的功夫，就来到了两伙修士交战的上空。\n光芒收敛，露出了一四十余岁的中年人来，身穿黑衣，容貌看上去并没有什么出奇，领口却绣着一银色的小剑标示，看上去就仿佛是哪里的执法使。\n庞大的威压从天而落，两伙修士大惊失色，这居然是一名元婴后期的修仙者，这种等级的老怪物，来这不毛之地干什么？\n心中忐忑，他们的斗法自然也停止了。\n对视一眼，刚刚还在殊死搏杀的两名首领不得不越众走了出来。\n“参见前辈，不知道您有什么吩咐，晚辈等一定会尽力照办的。”\n双方实力相差太多，由不得他们不心中忐忑。\n“你们要听从本尊的吩咐，那好，就将小命留在此处。”那中年人脸上带着一丝狞笑的开口了。",
      "word_count": 1164
    },
    "climax": {
      "core_conflict": "寻宝修士跪求让出紫罗草换取活命，执法使却以“二十万里禁区、擅闯者杀无赦”为令，翻手黑气化爪芒，以元婴后期之威对凝丹、筑基修士单方面屠戮，宝物与活口一口吞尽",
      "anchor_start": "“你们要听从本尊的吩咐，那好，就将小命留在此处。”那中年人脸上带着一丝狞笑的开口了。",
      "anchor_end": "寻宝修士人数虽多，但修为最高的，也不过凝丹级，如何抵挡得住，想要四散而逃都来不及了，惨叫声不绝于耳多，很快就全部魂归地府……",
      "text": "“你们要听从本尊的吩咐，那好，就将小命留在此处。”那中年人脸上带着一丝狞笑的开口了。\n“什么？”\n夺宝修士们顿时大惊失色。\n“前辈何出此语，您若要这紫罗草，尽管拿去，晚辈等绝不敢相争就是。”\n“紫罗草，哼，这东西虽然也算不错，但你们以为本尊是想要抢夺你们的灵物么，错了，我这是奉命行事，方圆二十万里，绝不允许出现任何生灵的踪迹，否则，杀无赦，会在这时候来寻宝，只能怨你们自己倒霉了。”\n那中年人话音未落，脸上就现出了狰狞之色，随后右手一舞，大片的黑气飞掠而出，凝结成爪芒，向着两伙修士激射。\n寻宝修士人数虽多，但修为最高的，也不过凝丹级，如何抵挡得住，想要四散而逃都来不及了，惨叫声不绝于耳多，很快就全部魂归地府……",
      "word_count": 308
    },
    "aftershock": {
      "anchor_start": "而同样的一幕，在这寒冷的冰原，不停的上演，寻宝修士陨落，死得稀里糊涂，正如那中年修士所说，要怪，就怪他们运气不好，因为就在这冰原之中，有一通往魔界的空间节点。",
      "anchor_end": "刚刚做好这一切，他突然像发现什么似的，抬起头颅，只见远处的天边，出现了一条灵舟。",
      "text": "而同样的一幕，在这寒冷的冰原，不停的上演，寻宝修士陨落，死得稀里糊涂，正如那中年修士所说，要怪，就怪他们运气不好，因为就在这冰原之中，有一通往魔界的空间节点。\n平时倒也丝毫异象也无，可处于衰弱期，就会显露出踪迹来了。\n有名额可以从这个节点进入魔界的各大势力，岂会让旁人在这里碍眼，故而这方圆二十万里，都已被列为了禁区，由那几大势力派出执法使共同维持，有生灵擅闯者，管你是人类还是妖族，杀无赦。\n这样做霸道了一些，然而修仙界弱肉强食，谁会和你讲道理，那中年人灭杀了两伙寻宝的修仙者，地上的紫罗草自然也不会放过，这对元婴后期的他也是一大收获，忙采摘装入怀里了。\n刚刚做好这一切，他突然像发现什么似的，抬起头颅，只见远处的天边，出现了一条灵舟。",
      "word_count": 319
    },
    "cliffhanger": {
      "anchor_start": "刚刚做好这一切，他突然像发现什么似的，抬起头颅，只见远处的天边，出现了一条灵舟。",
      "anchor_end": "女子则身形婀娜，五官用丝巾罩住。",
      "text": "刚刚做好这一切，他突然像发现什么似的，抬起头颅，只见远处的天边，出现了一条灵舟。\n那中年人将神识放出，很快就露出冷笑之色：“还真有不知死的家伙！”\n话音未落，他就迎着那灵舟飞上去了。\n由于距离太远了一些，无法感知上面修士的境界如何，不过乘坐这么简陋的飞行法器，想来也不值一提。\n很快近了，那灵舟上有一男一女。\n男子看上去不过二十左右年纪，容貌平凡以极，女子则身形婀娜，五官用丝巾罩住。",
      "word_count": 192
    }
  },
  "chapter_id": "ch_2217",
  "chapter_index": 2217,
  "prev_chapter_ending": "士清楚，她可是银瞳仙子的亲妹妹来着，只不过两人乃是同父异母，故而相貌上有很大不同，姐姐银瞳仙子带有妖族的血统，妹妹则是纯正的人类修仙者。\n“结果如何，那林轩答应去古魔界了么？”\n“他说要考虑一段时间才回复我？”\n“还要考虑？”\n“你放心，考虑不过是人之常情，他一定会去，倒是小妹妳，何必要去冒险呢，那古魔界之心，可是九死一生，每一次参加分神试炼的修仙者，回来的不过是十成中的一成罢了，姐姐当年都差点在古魔界陨落，妳实在没有不要步我后尘，我只有妳一个妹妹而已，便是上天入地，也会为妳寻到一枚分神丹地。”",
  "contrast": {
    "prompt": "请根据以下大纲与上章承接，撰写一篇 2000~2500 字的完整小说章节：\n\n【章节标题】：第七卷 纵横三界_第两千二百一十四章 荒芜冰原\n【上一章结尾】：士清楚，她可是银瞳仙子的亲妹妹来着，只不过两人乃是同父异母，故而相貌上有很大不同，姐姐银瞳仙子带有妖族的血统，妹妹则是纯正的人类修仙者。\n“结果如何，那林轩答应去古魔界了么？”\n“他说要考虑一段时间才回复我？”\n“还要考虑？”\n“你放心，考虑不过是人之常情，他一定会去，倒是小妹妳，何必要去冒险呢，那古魔界之心，可是九死一生，每一次参加分神试炼的修仙者，回来的不过是十成中的一成罢了，姐姐当年都差点在古魔界陨落，妳实在没有不要步我后尘，我只有妳一个妹妹而已，便是上天入地，也会为妳寻到一枚分神丹地。”\n【本章大纲】：\n1. 鼐龙界天霜郡北部荒芜冰原，两伙寻宝修士因一株紫罗草相遇，争执升级为死斗\n2. 黑袍元婴后期执法使降临，以“方圆二十万里禁区、擅闯者杀无赦”为名，将两伙修士尽数灭杀\n3. 揭示禁区真相：冰原深处藏有通往魔界的空间节点，正值衰弱期显踪，各大势力派执法使联手清场\n4. 执法使摘草入怀后察觉天边灵舟，误判来者不值一提，冷笑迎上，灵舟上却是一男一女，杀机骤然逼临\n\n【写作要求】：\n直接输出小说正文，保持情节连贯流畅，完成本章大纲所规划的所有情节走向。",
    "ai_draft": "## 第七卷 纵横三界 第两千二百一十四章 荒芜冰原\n\n风从极北的雪脊上刮下来，裹着细碎的冰碴，打在脸上如同无数根细针。\n\n鼐龙界天霜郡以北三十万里，便是这片被修士称作“荒芜冰原”的绝地。此地灵气稀薄得近乎于无，连妖兽都不愿久留，放眼望去，只有一望无际的灰白冰层与断裂的冰崖，在惨淡天光下泛着死气。\n\n可今日，这片死地却有了人声。\n\n冰崖之下，一株半尺高的紫罗草正从冰缝里探出叶来，叶片呈暗紫色，脉络间隐隐流转着一丝近乎透明的光华。此草三百年一熟，是炼制“凝婴丹”的主药之一，寻常修士得上一株，便足以少走数十年弯路。\n\n草前，两伙人已经对峙了半个时辰。\n\n左边是十余名散修，为首的是个虬髯大汉，筑基后期的气息毫不掩饰，手中一柄鬼头刀插在冰里，刀身还在嗡嗡震颤。右边则是天霜郡韩家的子弟，七人身着统一的青白法袍，为首的青年面如冠玉，腰间悬着一枚刻有“韩”字的玉牌，修为虽只有筑基中期，神色却倨傲得很。\n\n“赵老六，这株紫罗草是我韩家先发现的，你带着这群乌合之众横插一脚，是嫌命长么？”青年冷笑。\n\n虬髯大汉啐了一口带血的唾沫：“先发现？老子的人在这冰原上找了整整两个月，昨日便做了记号，你们今早才到，也配说先发现？韩家在这天霜郡是有些名头，可这荒原上，拳头才是道理。”\n\n话不投机，根本无须再多言。\n\n不知是谁先动了手，一道冰锥破空而起，紧接着刀光、剑芒、符箓的火光在冰崖下炸开。紫罗草的紫光被血光一寸寸淹没，不过数十息，雪地上便多了四五具尸体，鲜血涌出，来不及流淌便被寒气冻成暗红色的冰。\n\n韩家青年被虬髯大汉一刀劈飞，撞在冰壁上，口喷鲜血。他挣扎着摸出一枚传讯玉符，指尖刚注入灵力，一道刀气便已临头。\n\n“想报信？”虬髯大汉狞笑，“晚了！”\n\n刀落下的刹那，天，忽然暗了。\n\n不是乌云蔽日，而是一股无形无质、却重如山岳的威压，毫无征兆地从高天倾轧而下。虬髯大汉的刀停在半空，手臂剧烈颤抖，脸上的狞笑一点点僵住，转为极致的恐惧。\n\n冰崖之上，不知何时立着一个人。\n\n黑袍如墨，袍角绣着一道银色的锁链纹，面容隐在兜帽阴影里，只露出一截苍白削瘦的下巴。他负手而立，周身没有半点灵光外泄，可就是这样一个看似普通的人，让在场所有修士连一根手指都动弹不得。\n\n元婴后期。\n\n“方圆二十万里，划为禁区。”黑袍人的声音不高，却像冰层断裂般清晰地传进每个人耳中，“擅闯者，杀无赦。”\n\n虬髯大汉喉咙滚动，艰难道：“前辈……我等只是偶经此地，不知……”\n\n“不知？”黑袍人终于低头看了他一眼，那目光平静得像在看一块冰，“禁区的告示，三日前便已贴遍天霜郡三十六城。你们不是不知，只是觉得，一株紫罗草，值得赌一赌。”\n\n他抬起一只手，五指虚虚一握。\n\n没有惊天动地的轰鸣，也没有绚烂的法术。冰原上所有的寒气仿佛在这一瞬间听命于他，从四面八方汇聚、压缩，化作一只半透明的巨掌，自天穹缓缓按落。\n\n“前辈饶——”\n\n求饶声只出了半个字。\n\n巨掌落下，冰面无声塌陷数丈。十余具身躯连同那柄鬼头刀、那枚传讯玉符，尽数被碾入冰层，连血都未来得及溅出，便被冻成了一片暗红的冰花。\n\n天地重新安静下来，只剩风声。\n\n黑袍人飘然落下，走到那株紫罗草前，俯身摘下，随手收入袖中。他看也未看脚下的冰花一眼，仿佛方才碾死的不过是一群蝼蚁。事实上，于一位元婴后期而言，也确实如此。\n\n他负手望向冰原深处，兜帽下的眉头微微皱起。\n\n旁人只知这里是禁区，却不知禁区的由来。冰原最深处，一道通往古魔界的空间节点正在显踪。那节点每三百年便会进入一次衰弱期，界面壁垒薄如蝉翼，届时不仅魔气外泄，更有魔物循隙而出。而这一次的衰弱期，比典籍记载的还要早上半月，节点显踪的位置也偏移了千里。\n\n正因如此，鼐龙界几大势力才如此紧张，各自派出执法使，联手清场。二十万里的禁区，说到底，是不想让任何无关之人撞见那道裂缝，更不想让消息传出去，引来更多觊觎。\n\n“节点还有七日彻底显形。”黑袍人低声自语，“七日之内，这冰原上，不该有活口。”\n\n他话音未落，眉梢忽然一动。\n\n极远处，天边雪线之上，一点青光正贴着冰面缓缓飞来。那是一艘样式古朴的灵舟，舟身不过三丈，飞行时灵光内敛，速度也算不上快，看那模样，至多是金丹修士的代步之物。\n\n黑袍人眯起眼，灵识如潮水般铺展开去，转瞬便扫过灵舟。\n\n舟上两人。一男一女。男子气息内敛，瞧着不过金丹初期；女子一身白衣，修为更弱，仿佛刚结丹不久。\n\n“不知死活的東西。”黑袍人嘴角牵起一抹冷意，“禁区告示贴了三日，偏还有人往刀口上撞。”\n\n他没有丝毫犹豫，身形一晃，已掠上高空，黑袍在风雪中猎猎作响。元婴后期的气势毫无保留地释放开来，方圆百里的寒气都被压得凝滞，仿佛整片冰原都在他脚下俯首。\n\n灵舟似乎察觉到了什么，缓缓停下。\n\n黑袍人负手立于虚空，居高临下，声音裹着威压滚滚而去：“此地已划为禁区，速退，尚可留命。”\n\n灵舟上没有回应。\n\n片刻，舟首的舱门轻轻打开，一男一女并肩走出。男子一身玄衣，面容清俊，眉眼间却有一种与年纪不符的沉静；白衣女子立在他身侧，容色绝美，一双眸子清澈如水，只是那眼底深处，藏着一丝不易察觉的紧张。\n\n两人抬头，望向高空中的黑袍人。\n\n就在这一瞬，黑袍人心中莫名一凛。\n\n那玄衣男子明明只有金丹初期的气息，可当那双眼睛看过来时，竟让他这个元婴后期的修士，生出一种被什么东西轻轻攫住的错觉。\n\n下一瞬，杀机骤临。\n\n不是来自天上，也不是来自地下，而是从那艘看似平平无奇的灵舟上，毫无预兆地暴涨而起。那杀机冷冽、纯粹，仿佛积攒了千百年的寒冰在一刹那间尽数迸裂，直指他的眉心。\n\n黑袍人的冷笑，凝固在了脸上。\n\n荒芜冰原上呼啸了整日的风，忽然停了。",
    "human_original": "第七卷 纵横三界_第两千二百一十四章 荒芜冰原\n\n第两千二百一十四章\n\n荒芜冰原\n\n作为灵界屈指可数的顶级界面之一，鼐龙界的面积辽阔无比，共分为九九八十一个郡府。\n\n每一个郡的面积那也是相当辽阔，恐怕比东海修仙界也差不了许多。\n\n换句话说，别的资源暂且不提，鼐龙界光是面积，就将近东海百倍有余。\n\n这么广袤的面积，当然难免会有不毛之地。\n\n比如在天霜郡的北部，就有一片冰原，广袤无边，终年皆有鹅毛大雪飘落，寒冰厚达千丈有余，万年不腐，从来就不曾融化过。\n\n这一片冰原别说凡人，就算是修仙者与妖族，也很少有人会到此处，气候实在是太恶劣了，这里不仅寒冷，而且灵气非常的稀薄。\n\n这是一个平静的早晨，太阳才刚刚初升，鹅毛般的大雪依旧从天空中飘落，阳光洒落，却没有一点温度，冷冷的。\n\n轰！\n\n爆裂声传入耳朵，将这份宁静给狠狠的撕破。\n\n只见远处的天空之中，一道红芒，一道黑气纵横捭阖，正不停的缠斗着。\n\n这片冰原虽是人迹罕至之所，但并不代表就一名修仙者都不会来了。\n\n尽管牠的灵气稀薄，尽管牠的条件恶劣到极处。\n\n可那又如何，大自然自有牠的规律，在这样的地方，反而有几位灵药适合生长。\n\n因为这个缘故，偶尔也会有修士来到此处，去寻找那发财机会的。\n\n要知道这种灵药殊为难得，采摘到一棵，拿到拍卖会中，就可以卖出天价来着。\n\n天下熙熙，皆为利往。\n\n即使是这样的不毛之所，也可以看见寻宝修士踪迹的。\n\n可惜这片冰原实在太大了，虽然没有强大的妖兽出没，但想要找到一颗灵药，也不知道需花费多少功夫。\n\n常常十年八年，也不一定有收获。\n\n偏偏今天却有这样的巧合，两伙寻宝修士迎面相遇了。\n\n原本这也没有什么，大路朝天，各走一边，双方的实力相差仿佛，自然不会有谁心存歹念。\n\n按理说，这意外的重逢，不应该有什么波折，大家打一个招呼，就该各奔东西了。\n\n可巧就巧在，他们相遇的地点，有一颗珍贵的灵物。\n\n紫罗草！\n\n或许在林轩这样的眼里，此物不值一提，然而对凝丹期修士来说，却是可遇而不可求的宝物，足够让他们修到元婴期也不用担心晶石的来源了。\n\n这样的宝物，谁肯相让呢？\n\n两伙寻宝修士立刻就起了争执，说是自己先看见的这件宝物。\n\n其实这根本就丝毫意义也无，谁先看见的又怎么样呢？\n\n归根结底，还是要看实力，于是在吵闹一番之后，双方开始大打出手。\n\n不死不休！\n\n两伙寻宝修士的实力相差仿佛。\n\n领头的都是凝丹后期的修仙者，除此以外，都是初期与中期的修士，还有筑基期的子侄。\n\n人数也相近，一时之间，打得是激烈无比，短时间内，却难以分出胜负。\n\n转眼，已是小半个时辰过去了，双方皆陨落了不少人手，却没有人愿意就此退后。\n\n然而就在此刻，天边突然飞来了一抹亮丽的惊虹。\n\n开始尚远，然而速度极快，不过一眨眼的功夫，就来到了两伙修士交战的上空。\n\n光芒收敛，露出了一四十余岁的中年人来，身穿黑衣，容貌看上去并没有什么出奇，领口却绣着一银色的小剑标示，看上去就仿佛是哪里的执法使。\n\n庞大的威压从天而落，两伙修士大惊失色，这居然是一名元婴后期的修仙者，这种等级的老怪物，来这不毛之地干什么？\n\n心中忐忑，他们的斗法自然也停止了。\n\n对视一眼，刚刚还在殊死搏杀的两名首领不得不越众走了出来。\n\n“参见前辈，不知道您有什么吩咐，晚辈等一定会尽力照办的。”\n\n双方实力相差太多，由不得他们不心中忐忑。\n\n“你们要听从本尊的吩咐，那好，就将小命留在此处。”那中年人脸上带着一丝狞笑的开口了。\n\n“什么？”\n\n夺宝修士们顿时大惊失色。\n\n“前辈何出此语，您若要这紫罗草，尽管拿去，晚辈等绝不敢相争就是。”\n\n“紫罗草，哼，这东西虽然也算不错，但你们以为本尊是想要抢夺你们的灵物么，错了，我这是奉命行事，方圆二十万里，绝不允许出现任何生灵的踪迹，否则，杀无赦，会在这时候来寻宝，只能怨你们自己倒霉了。”\n\n那中年人话音未落，脸上就现出了狰狞之色，随后右手一舞，大片的黑气飞掠而出，凝结成爪芒，向着两伙修士激射。\n\n寻宝修士人数虽多，但修为最高的，也不过凝丹级，如何抵挡得住，想要四散而逃都来不及了，惨叫声不绝于耳多，很快就全部魂归地府……\n\n而同样的一幕，在这寒冷的冰原，不停的上演，寻宝修士陨落，死得稀里糊涂，正如那中年修士所说，要怪，就怪他们运气不好，因为就在这冰原之中，有一通往魔界的空间节点。\n\n平时倒也丝毫异象也无，可处于衰弱期，就会显露出踪迹来了。\n\n有名额可以从这个节点进入魔界的各大势力，岂会让旁人在这里碍眼，故而这方圆二十万里，都已被列为了禁区，由那几大势力派出执法使共同维持，有生灵擅闯者，管你是人类还是妖族，杀无赦。\n\n这样做霸道了一些，然而修仙界弱肉强食，谁会和你讲道理，那中年人灭杀了两伙寻宝的修仙者，地上的紫罗草自然也不会放过，这对元婴后期的他也是一大收获，忙采摘装入怀里了。\n\n刚刚做好这一切，他突然像发现什么似的，抬起头颅，只见远处的天边，出现了一条灵舟。\n\n那中年人将神识放出，很快就露出冷笑之色：“还真有不知死的家伙！”\n\n话音未落，他就迎着那灵舟飞上去了。\n\n由于距离太远了一些，无法感知上面修士的境界如何，不过乘坐这么简陋的飞行法器，想来也不值一提。\n\n很快近了，那灵舟上有一男一女。\n\n男子看上去不过二十左右年纪，容貌平凡以极，女子则身形婀娜，五官用丝巾罩住。",
    "ai_word_count": 2319,
    "human_word_count": 2183
  }
}