{
  "chapter_title": "第五卷_第928章 传法之遗念",
  "chapter_outline": [
    "李凡通过终末解离碟接收卫奇正生前记忆，发现中年修士传授仙盟秘辛：天城石像藏有传法天尊遗念，可引动天尊法相。",
    "中年修士揭示三十三位仙选者需心念合一，共同御使法相，并展开虚拟轮回训练以培养默契。",
    "训练从虚拟轮回升级到黑暗密闭空间，青年们被迫在剥夺感官的环境中继续磨合。"
  ],
  "truth_base": {
    "protagonist_plan": "李凡通过终末解离碟解析卫奇正记忆，寻找仙盟秘密与传法天尊遗念的弱点，为后续对抗仙盟布局。",
    "antagonist_horizon": "中年修士（仙盟高层）自信三十三位仙选者能通过训练达成同心同德，从而成功引动天尊法相，消灭五老会。",
    "information_gap": "李凡知晓卫奇正已身死道消，且仙盟计划存在变数；而仙盟不知李凡正通过记忆窥探其核心机密。",
    "deadline": "仙盟即将完成三十三位仙选者的训练，一旦成功引动天尊法相，五老会与玄黄界格局将彻底颠覆。"
  },
  "segments": {
    "opening": {
      "anchor_start": "卫奇正记忆中，慷慨陈词的中年修士，李凡虽然从未见过。",
      "anchor_end": "李凡一边观看，一边从化道石记录的场景中寻找相似人物。",
      "text": "卫奇正记忆中，慷慨陈词的中年修士，李凡虽然从未见过。\n\n但不知为何，此人行为举止以及说话的神态，都让李凡隐隐感到熟悉。\n\n尤其是他眼神中不时闪过的寒光，更让李凡确定，自己肯定在某一世与此人有过接触。\n\n李凡一边观看，一边从化道石记录的场景中寻找相似人物。",
      "word_count": 127
    },
    "ramp_up": {
      "anchor_start": "“仙盟与五老会对峙数千年，互有胜负。玄黄修士，被战乱波及，苦不堪言。”",
      "anchor_end": "三十三位青年，此刻全都怔在当场。",
      "text": "“仙盟与五老会对峙数千年，互有胜负。玄黄修士，被战乱波及，苦不堪言。”\n\n“为了彻底终结这种局面，诸多先辈殚精竭虑，终于想出了一个堪称绝妙的方法。”\n\n随着中年修士的话，万仙盟各州的缩影，浮现在众青年眼前。\n\n“众所周知，我们万仙盟每一座浮空天城内，都有一座天尊石像。绝大多数世人都认为，这是为了缅怀天尊伟业而建造。但你们有没有想过，这些石像，其实可能还有别的用途？”\n\n此言一出，青年们全都目露奇色。\n\n“你们在进入仙盟总部的时候，应该都感应到了传法天尊残留的那缕气息。”\n\n“而建造这些石像，同样是传法天尊他老人家授意。”\n\n“甚至每一座浮空城的位置，都是祂提前指定的。”\n\n“每一尊石像中，都有天尊的一道遗念残留。若是引动，便可引动相当于天尊一瞥的力量……”\n\n中年修士讲到此处，故意放慢说话的速度。\n\n而那些青年们也都着了套，听到只是【天尊一瞥】，全都不禁有些不以为然。\n\n就算传法天尊再厉害，紧紧是看上一眼而已，又能怎么样？\n\n中年修士看到青年们的神情，露出了意料之中的笑容。\n\n而后神色肃穆，掷地有声：“天尊一瞥，就可抵挡寻常长生境全力一击！”\n\n话音不断回荡，在场的三十三位修士，全都慢慢瞪大了眼睛。\n\n“怎么可能？”当场就有青年修士忍不住反驳道。\n\n“传法天尊再强，也不过还是长生境。同为长生境，怎么差距会如此之大？”\n\n“若天尊他老人家真的这么强，当年为何又不干脆直接一统玄黄？反而留下这么一个烂摊子？”\n\n场下当即炸开了锅。\n\n无视中年修士的权威，青年们据理力争起来。\n\n中年修士目光扫过，李凡熟悉的寒芒笼罩下，青年们一个个又被迫重新安静下来。\n\n“天尊的思量，岂是我们能明白的？当年没有统一玄黄界，自然有他的原因。不过今时不同往日，我们接到了天尊明确的指示。”\n\n“是时候，让玄黄界只有一道声音了。”\n\n中年修士满是杀气道。\n\n“而你们，就是完成这个伟大目标的关键。”\n\n中年修士随手一指，众人面前的画面再度变化。\n\n万仙盟领地的景色慢慢消失，只留下近千个代表着天城的闪光点。\n\n而后，一道道银色的光线将这些亮点连接起来。\n\n“你们看出来什么了吗？”中年修士问道。\n\n卫奇正第一个发言，脱口而出道：“这……这简直像极了人体经络？！”\n\n其他青年纷纷看向卫奇正，而后又死死盯着前方越来越明显的点线交织图。\n\n全都恍然大悟。\n\n“难道说……”\n\n一个不可置信的念头不禁在他们心中涌现。\n\n中年修士开口，证实了他们的猜测：“天尊遗念，按照人体经络的特殊规律分布在仙盟大地上。若是能用秘法引动，就可从虚空中召唤出，一具以传法天尊为原型的法相。”\n\n“天尊遗念，相当于驱动法相的力量源泉。”\n\n“若是能全都引动……”\n\n中年修士深吸一口气：“五老会不日可灭！”\n\n三十三位青年，此刻全都怔在当场。",
      "word_count": 1154
    },
    "climax": {
      "core_conflict": "中年修士揭示三十三位仙选者需心念合一共同御使天尊法相，并展开残酷训练，青年们从憧憬到被迫承受漫长虚拟轮回与黑暗禁闭。",
      "anchor_start": "三十三位青年，此刻全都怔在当场。",
      "anchor_end": "“很好，现在我们开始第二课。”丝毫没有顾忌青年们的想法，中年修士开口道。",
      "text": "三十三位青年，此刻全都怔在当场。\n\n“而你们，就是开启这股强大力量的钥匙……”\n\n在中年修士的讲述中，青年们纷纷被吸引了心神。眼神中满是憧憬于跃跃欲试。\n\n天尊遗念的力量太过庞大，只靠一位修士，根本无法全盘引动、继承。\n\n只有分而划之，化作三十三域。\n\n每一域都需要一位绝世之才主持。\n\n当这三十三位仙选者，能够做到心念合一的地步。\n\n再不断熟悉天尊遗念，就可一齐充当翘板，引动天尊遗念之力！\n\n“第一次唤出天尊法相，所持续的时间定然不会太长。”\n\n“你们要抓紧这个时机，熟悉、领悟此中的玄机。”\n\n“而且，在这个过程中，你们当中任何一个人，都不能有丝毫的分心。要知道，在那时候，就相当于你们三十三人在共同御使着法相。”\n\n“如果你们当中有分歧，很可能导致法相崩解。”\n\n中年修士详尽的为青年们介绍着关于天尊法相的种种事宜。\n\n这三十三位修士，无一不是意气风发的少年俊杰。心中都有自己的傲气。\n\n要他们心往一处使，又何其难？\n\n所以万仙盟接下来为他们准备了一连串的训练。\n\n一处满是银白光芒的透明球体内，似乎分布着无数快速衍化的不同世界。\n\n这三十三人的神识被投入世界中，经历种种磨难。\n\n有红尘乱世，有凡人江湖。\n\n有上古修仙界奇遇，有未来可能场景。\n\n但无一例外的，他们三十三人都被强行凑成羁绊。因为种种原因，聚到一起。\n\n只有达成同心同德，宛若一体的境地，才会最终从轮回中解脱。\n\n而只要他们当中有任何一人有异心，轮回都会再次开始。\n\n即便有着万仙盟的刻意引导，这也是一段相当漫长的岁月。\n\n不知道在虚拟中究竟过去了多少年，当这些“青年”终于脱困而出的时候。\n\n他们脸上的青涩已经消失不见。\n\n眼中满是沧桑。\n\n环顾四周，脸上有几分戒备与茫然。\n\n“啪啪啪……”\n\n在中年修士不断地拍手声中，他们往昔的、被压制的记忆终于复苏。\n\n“很好，现在我们开始第二课。”丝毫没有顾忌青年们的想法，中年修士开口道。",
      "word_count": 804
    },
    "aftershock": {
      "anchor_start": "接下来，卫奇正他们，又经历了更加残酷的训练。",
      "anchor_end": "眼不能视耳不能听。",
      "text": "接下来，卫奇正他们，又经历了更加残酷的训练。\n\n全都被赤裸着身子，关到只有无尽黑暗的密闭空间中。\n\n空间中除了模拟出的传法天尊气息之外，再无其他物。\n\n眼不能视耳不能听。",
      "word_count": 85
    },
    "cliffhanger": {
      "anchor_start": "眼不能视耳不能听。",
      "anchor_end": "眼不能视耳不能听。",
      "text": "眼不能视耳不能听。",
      "word_count": 9
    }
  },
  "chapter_id": "ch_0984",
  "chapter_index": 984,
  "prev_chapter_ending": "来的画面中断了片刻。\n当画面恢复之后，无数修士们所看到的，竟然是五位神情各异的天尊法相、跟五道光华相互对峙的场面！\n整个玄黄界，仿佛都因为这种力量的冲击而在瑟瑟发抖。\n而灵木界的李凡，更是在之前就隐隐感受到，一片终末解离碟附身所在、三十三天玄者之一的卫奇正，他的生命气息正在急速消耗！\n如今已经彻底油尽灯枯、身死道消了！\n“这是……”\n李凡眼中闪过一道精光。\n脑海中，终末解离碟发出微微白光。\n正在接收着大量的数据。\n那些都是卫奇正生前所经历的场景。\n“仙盟能否一统玄黄界，希望全都寄托在你们身上！”",
  "contrast": {
    "prompt": "请根据以下大纲与上章承接，撰写一篇 2000~2500 字的完整小说章节：\n\n【章节标题】：第五卷_第928章 传法之遗念\n【上一章结尾】：来的画面中断了片刻。\n当画面恢复之后，无数修士们所看到的，竟然是五位神情各异的天尊法相、跟五道光华相互对峙的场面！\n整个玄黄界，仿佛都因为这种力量的冲击而在瑟瑟发抖。\n而灵木界的李凡，更是在之前就隐隐感受到，一片终末解离碟附身所在、三十三天玄者之一的卫奇正，他的生命气息正在急速消耗！\n如今已经彻底油尽灯枯、身死道消了！\n“这是……”\n李凡眼中闪过一道精光。\n脑海中，终末解离碟发出微微白光。\n正在接收着大量的数据。\n那些都是卫奇正生前所经历的场景。\n“仙盟能否一统玄黄界，希望全都寄托在你们身上！”\n【本章大纲】：\n1. 李凡通过终末解离碟接收卫奇正生前记忆，发现中年修士传授仙盟秘辛：天城石像藏有传法天尊遗念，可引动天尊法相。\n2. 中年修士揭示三十三位仙选者需心念合一，共同御使法相，并展开虚拟轮回训练以培养默契。\n3. 训练从虚拟轮回升级到黑暗密闭空间，青年们被迫在剥夺感官的环境中继续磨合。\n\n【写作要求】：\n直接输出小说正文，保持情节连贯流畅，完成本章大纲所规划的所有情节走向。",
    "ai_draft": "## 第五卷_第928章 传法之遗念\n\n白光如潮水般涌入李凡的识海。\n\n终末解离碟的震颤越来越剧烈，像是一颗即将燃尽最后能量的星辰，将卫奇正生前所有的记忆碎片毫无保留地倾泻而出。李凡闭目凝神，任由那些画面在脑海中翻涌重组，最终定格在一个他从未见过的场景之中。\n\n那是一座悬浮于虚空中的天城。\n\n城阙巍峨，通体由一种散发着淡金色泽的奇异石材筑成，每一块砖石上都铭刻着密密麻麻的符文，在虚空中散发着若有若无的微光。而天城的最中央，矗立着一尊巨大的石像。石像面目模糊，仿佛被岁月侵蚀了千万年，但其姿态却有一种说不出的庄严，一只手结印于胸前，另一只手遥遥指向天际。\n\n石像脚下，一个中年修士负手而立。\n\n“卫奇正，你听好了。”中年修士的声音苍老而沉稳，带着一种不容置疑的决断，“我时间不多了，接下来的每一句话，你都要牢牢记住。”\n\n画面中的卫奇正年轻了许多，面容肃穆，恭敬地跪坐在中年修士身后。\n\n“天城石像之中，藏着传法天尊的一缕遗念。”中年修士缓缓转过身来，他的面容清癯，眉宇间有着化不开的疲惫，但目光依旧锐利如刀，“当年传法天尊在玄黄界与域外天魔一战，肉身崩灭，元神散尽，唯独这一缕遗念封存于石像之内，等待后世有缘人。”\n\n“师尊，这遗念……”卫奇正欲言又止。\n\n“这遗念，是唯一能够引动天尊法相的关键。”中年修士沉声道，“但光有遗念还不够。传法天尊的法相需要三十三道仙选者的心念共同御使，缺一不可。这便是当年仙盟选拔你们三十三人的真正原因。”\n\n李凡听到这里，心中一震。\n\n三十三位仙选者。心念合一，共同御使法相。这说明仙盟从一开始就在下一盘大棋，每一位仙选者都是这盘棋局中不可或缺的棋子。\n\n画面中的中年修士继续说着，语速越来越快，仿佛生怕来不及说完：“三十三人，缺一不可。心念合一的难度，远超你们的想象。每个人的修为不同、心性不同、对天道的理解也不同，要让三十三道心念拧成一股绳，光靠口头上的配合绝无可能。所以——”\n\n他抬手一挥，虚空中浮现出一面古朴的铜镜。\n\n“这是轮回镜，可以构建虚拟轮回幻境。从今日起，你们三十三人要进入其中，经历一世又一世的轮回磨砺。每一世，我都会给你们设定不同的身份、不同的境遇，但核心只有一个——你们必须在每一世中找到彼此，信任彼此，最终心念相通。”\n\n卫奇正的记忆在这里变得模糊起来。李凡能感觉到，那些画面像是被水浸湿的墨迹，晕染开来，只剩下零星的片段：轮回镜中，三十三道身影在无数个世界中辗转——有时是战场上的敌我双方，有时是同门师兄弟，有时甚至是生死相搏的仇人。但无论身份如何变化，他们最终都会在某一刻产生一种奇异的共鸣，仿佛灵魂深处有一根看不见的线，将他们紧紧拴在一起。\n\n一次，两次，十次，百次。\n\n轮回的次数越来越多，三十三人之间的默契也越来越深。到后来，他们甚至不需要开口交流，一个眼神、一个手势，便能明白彼此的意图。\n\n然而中年修士并未就此满足。\n\n记忆画面再度一转，李凡看到了一片彻底的黑暗。\n\n那是一种连神识都无法穿透的黑暗，仿佛整个世界都被吞噬了。卫奇正和其他三十二位仙选者被投入了这片黑暗之中，没有光，没有声音，没有气味，甚至感觉不到时间的流逝。五感被彻底剥夺，唯一能感知到的，只有身边其他人的心念波动。\n\n“这是最后一关。”中年修士的声音从黑暗之外传来，苍老而决绝，“在绝对的黑暗中，你们只能依靠心念的共鸣来确认彼此的存在。只有当你们三十三人的心念在黑暗中完全同步，才能真正御使传法天尊的法相。记住——仙盟能否一统玄黄界，希望全都寄托在你们身上！”\n\n黑暗之中，卫奇正感到了前所未有的恐惧。\n\n那种恐惧来自本能深处，是生命对绝对虚无的抗拒。他的心跳在加速，呼吸变得急促，脑海中不断涌出各种杂念。但就在他几乎要崩溃的时候，一只手在黑暗中握住了他的手腕。那只手冰凉而颤抖，显然对方也在恐惧，但那只手没有松开。\n\n紧接着，第二道心念靠了过来，第三道，第四道……\n\n一道又一道心念在黑暗中汇聚，像是无数条细小的溪流汇入江河，最终形成了一股汹涌澎湃的洪流。那种共鸣越来越强烈，越来越清晰，到最后，卫奇正甚至分不清哪些心念是自己的，哪些是别人的。他们仿佛融为了一体，三十三个人变成了一颗跳动的心脏。\n\n黑暗在那一刻碎裂了。\n\n光芒从裂缝中倾泻而下，照亮了天城石像上空浮现出的巨大法相。那法相庄严慈悲，一手结印，一手遥指天际，正是传法天尊的模样。三十三道心念如同三十三条金线，将法相与众人紧紧相连。\n\n“成了……”中年修士的声音中带着如释重负的欣慰，“你们做到了。”\n\n记忆到此戛然而止。\n\n李凡猛地睁开双眼，额头上沁出了一层细密的冷汗。终末解离碟的白光渐渐暗淡下去，最终归于沉寂。\n\n卫奇正死了。他带着这些记忆死在了灵木界的战场上，油尽灯枯，身死道消。但他在临死之前，通过终末解离碟将这些至关重要的信息传递了出来。\n\n李凡深吸一口气，消化着脑海中庞大的信息量。传法天尊的遗念藏在天城石像之中，三十三位仙选者必须心念合一才能御使天尊法相，而卫奇正他们当年是通过轮回镜和黑暗空间的双重训练才达到了那种默契。\n\n“三十三个人……”李凡喃喃自语，眉头紧锁。\n\n如今卫奇正已死，三十三人少了一个。心念合一的前提是三十三人缺一不可，那剩下的三十二人，还能御使法相吗？\n\n他抬起头，望向远处的天际。玄黄界的天穹之上，五道光华与五道天尊法相对峙的画面若隐若现，那种毁天灭地的力量波动隔着不知多少万里都能清晰感知到。\n\n时间不多了。\n\n李凡站起身来，目光变得坚定。卫奇正用生命换来的这些情报，绝不能白费。他必须尽快将传法天尊遗念的消息传递给仙盟，同时也要弄清楚，在缺少一人的情况下，三十三道心念是否还能重新聚合。\n\n他低头看了一眼掌心中微微发烫的终末解离碟，心中隐隐有了一个猜测。卫奇正选择在临死前将记忆传给他，恐怕不仅仅是让他传递消息这么简单。\n\n终末解离碟能够承载修士的记忆与心念，那么……它是否也能承载仙选者的心念共鸣？\n\n这个念头一闪而过，李凡没有深想，将其压在心底。当务之急，是先找到仙盟的其他人。\n\n他身形一动，化作一道流光，朝着天际那道对峙的画面疾驰而去。",
    "human_original": "第928章 传法之遗念\n\n第928章\n\n传法之遗念\n\n卫奇正记忆中，慷慨陈词的中年修士，李凡虽然从未见过。\n\n但不知为何，此人行为举止以及说话的神态，都让李凡隐隐感到熟悉。\n\n尤其是他眼神中不时闪过的寒光，更让李凡确定，自己肯定在某一世与此人有过接触。\n\n李凡一边观看，一边从化道石记录的场景中寻找相似人物。\n\n“仙盟与五老会对峙数千年，互有胜负。玄黄修士，被战乱波及，苦不堪言。”\n\n“为了彻底终结这种局面，诸多先辈殚精竭虑，终于想出了一个堪称绝妙的方法。”\n\n随着中年修士的话，万仙盟各州的缩影，浮现在众青年眼前。\n\n“众所周知，我们万仙盟每一座浮空天城内，都有一座天尊石像。绝大多数世人都认为，这是为了缅怀天尊伟业而建造。但你们有没有想过，这些石像，其实可能还有别的用途？”\n\n此言一出，青年们全都目露奇色。\n\n“你们在进入仙盟总部的时候，应该都感应到了传法天尊残留的那缕气息。”\n\n“而建造这些石像，同样是传法天尊他老人家授意。”\n\n“甚至每一座浮空城的位置，都是祂提前指定的。”\n\n“每一尊石像中，都有天尊的一道遗念残留。若是引动，便可引动相当于天尊一瞥的力量……”\n\n中年修士讲到此处，故意放慢说话的速度。\n\n而那些青年们也都着了套，听到只是【天尊一瞥】，全都不禁有些不以为然。\n\n就算传法天尊再厉害，紧紧是看上一眼而已，又能怎么样？\n\n中年修士看到青年们的神情，露出了意料之中的笑容。\n\n而后神色肃穆，掷地有声：“天尊一瞥，就可抵挡寻常长生境全力一击！”\n\n话音不断回荡，在场的三十三位修士，全都慢慢瞪大了眼睛。\n\n“怎么可能？”当场就有青年修士忍不住反驳道。\n\n“传法天尊再强，也不过还是长生境。同为长生境，怎么差距会如此之大？”\n\n“若天尊他老人家真的这么强，当年为何又不干脆直接一统玄黄？反而留下这么一个烂摊子？”\n\n场下当即炸开了锅。\n\n无视中年修士的权威，青年们据理力争起来。\n\n中年修士目光扫过，李凡熟悉的寒芒笼罩下，青年们一个个又被迫重新安静下来。\n\n“天尊的思量，岂是我们能明白的？当年没有统一玄黄界，自然有他的原因。不过今时不同往日，我们接到了天尊明确的指示。”\n\n“是时候，让玄黄界只有一道声音了。”\n\n中年修士满是杀气道。\n\n“而你们，就是完成这个伟大目标的关键。”\n\n中年修士随手一指，众人面前的画面再度变化。\n\n万仙盟领地的景色慢慢消失，只留下近千个代表着天城的闪光点。\n\n而后，一道道银色的光线将这些亮点连接起来。\n\n“你们看出来什么了吗？”中年修士问道。\n\n卫奇正第一个发言，脱口而出道：“这……这简直像极了人体经络？！”\n\n其他青年纷纷看向卫奇正，而后又死死盯着前方越来越明显的点线交织图。\n\n全都恍然大悟。\n\n“难道说……”\n\n一个不可置信的念头不禁在他们心中涌现。\n\n中年修士开口，证实了他们的猜测：“天尊遗念，按照人体经络的特殊规律分布在仙盟大地上。若是能用秘法引动，就可从虚空中召唤出，一具以传法天尊为原型的法相。”\n\n“天尊遗念，相当于驱动法相的力量源泉。”\n\n“若是能全都引动……”\n\n中年修士深吸一口气：“五老会不日可灭！”\n\n三十三位青年，此刻全都怔在当场。\n\n“而你们，就是开启这股强大力量的钥匙……”\n\n在中年修士的讲述中，青年们纷纷被吸引了心神。眼神中满是憧憬于跃跃欲试。\n\n天尊遗念的力量太过庞大，只靠一位修士，根本无法全盘引动、继承。\n\n只有分而划之，化作三十三域。\n\n每一域都需要一位绝世之才主持。\n\n当这三十三位仙选者，能够做到心念合一的地步。\n\n再不断熟悉天尊遗念，就可一齐充当翘板，引动天尊遗念之力！\n\n“第一次唤出天尊法相，所持续的时间定然不会太长。”\n\n“你们要抓紧这个时机，熟悉、领悟此中的玄机。”\n\n“而且，在这个过程中，你们当中任何一个人，都不能有丝毫的分心。要知道，在那时候，就相当于你们三十三人在共同御使着法相。”\n\n“如果你们当中有分歧，很可能导致法相崩解。”\n\n中年修士详尽的为青年们介绍着关于天尊法相的种种事宜。\n\n这三十三位修士，无一不是意气风发的少年俊杰。心中都有自己的傲气。\n\n要他们心往一处使，又何其难？\n\n所以万仙盟接下来为他们准备了一连串的训练。\n\n一处满是银白光芒的透明球体内，似乎分布着无数快速衍化的不同世界。\n\n这三十三人的神识被投入世界中，经历种种磨难。\n\n有红尘乱世，有凡人江湖。\n\n有上古修仙界奇遇，有未来可能场景。\n\n但无一例外的，他们三十三人都被强行凑成羁绊。因为种种原因，聚到一起。\n\n只有达成同心同德，宛若一体的境地，才会最终从轮回中解脱。\n\n而只要他们当中有任何一人有异心，轮回都会再次开始。\n\n即便有着万仙盟的刻意引导，这也是一段相当漫长的岁月。\n\n不知道在虚拟中究竟过去了多少年，当这些“青年”终于脱困而出的时候。\n\n他们脸上的青涩已经消失不见。\n\n眼中满是沧桑。\n\n环顾四周，脸上有几分戒备与茫然。\n\n“啪啪啪……”\n\n在中年修士不断地拍手声中，他们往昔的、被压制的记忆终于复苏。\n\n“很好，现在我们开始第二课。”丝毫没有顾忌青年们的想法，中年修士开口道。\n\n……\n\n接下来，卫奇正他们，又经历了更加残酷的训练。\n\n全都被赤裸着身子，关到只有无尽黑暗的密闭空间中。\n\n空间中除了模拟出的传法天尊气息之外，再无其他物。\n\n眼不能视耳不能听。",
    "ai_word_count": 2500,
    "human_word_count": 2189
  }
}