{
  "chapter_title": "第八卷 上古隐秘_第三千二百一十八章 天罗仙果与补天芝",
  "chapter_outline": [
    "林轩以九宫须臾剑破开灵狐尊者药园禁制，药园与其中灵药尽数显露。",
    "林轩先收取成熟的天罗仙果，随后发现可让渡劫以下修士增寿三五百年的补天芝，并将其全部笑纳。",
    "林轩将灵狐山纳入云隐宗版图，命公孙玉儿负责建立分舵，完成地盘与门派的扩张。",
    "林轩回到洞府清点宝蛇等强敌储物所得，蛇形仙剑现世，被认出是先天残宝，留下新的悬念。"
  ],
  "truth_base": {
    "protagonist_plan": "林轩以破禁取药、清点战利品为核心，既收取天罗仙果、补天芝与芙蓉雪参等珍稀灵药，又借灵狐山建立云隐宗分舵，实现资源与地盘双扩张；补天芝虽对渡劫期无益，却可作为向其他老怪物换取珍贵材料的奇货。",
    "antagonist_horizon": "灵狐尊者一脉误以为药园禁制足以自守，未料林轩以九宫须臾剑轻易破去；其徒子徒孙被灭后，洞天福地反被视作云隐宗分舵的现成基业。",
    "information_gap": "补天芝对渡劫期几乎无用，却能让渡劫以下修士增寿三百年至五百年不等，价值因人而异；外界尚不知林轩已灭灵狐尊者一脉、接管灵狐山，更不知其储物袋中藏有先天残宝。",
    "deadline": "灵药成熟且灵狐山无主，林轩须在消息走漏前完成采摘、接管与清点；而先天残宝刚现世，随时可能成为下一轮争夺的引爆点。"
  },
  "segments": {
    "opening": {
      "anchor_start": "“看来这位灵狐尊者，身家在渡劫期存在中，也算颇为富有之人了。”",
      "anchor_end": "随后势夹万钧的朝着前方斩去。",
      "text": "“看来这位灵狐尊者，身家在渡劫期存在中，也算颇为富有之人了。”\n林轩喃喃自语的声音传入耳朵，此事对他来说，算是一意外收获。\n随后林轩谈笑间袖袍一拂，银光耀目，九宫须臾剑自衣袖间鱼游而出。\n“合！”\n也不见林轩多余的动作，那数十柄仙剑就朝着同一方向激射而去了。\n随后法则之力逸散而出，半空中灵芒大做，却是一柄银光闪闪的仙剑在半空中若隐若现的鱼跃而出。\n长数十丈有余，银光犀利，那声威看上去当真是无以伦比。\n随后势夹万钧的朝着前方斩去。",
      "word_count": 216
    },
    "ramp_up": {
      "anchor_start": "刺啦……",
      "anchor_end": "“补天芝。”",
      "text": "刺啦……\n这一次丝毫悬念也无，那光幕虽然再一次将晶莹小盾幻化而出。\n但根本就没有用途。\n林轩的随手一击，此禁制或许还能挡住，但此时在九宫须臾剑的威能下，却成了班门弄斧。\n说成是螳臂挡车也不为过，清脆的碎裂声传入耳朵。\n那看似凝厚玄妙的光幕寸寸碎裂掉了。\n再无禁制阻隔，药园中的一切自然是显露无遗了。\n一阵沁人心脾的清香扑面而出。\n林轩脸上闪过一丝喜色，越发肯定自己此行将大有收获。\n整座药园是位于一小小的山谷，就面积来说，其实并不出色。\n林轩粗略一估，前后也不过数亩。\n林轩将神识放出，确定再没有禁制隐伏，于是一抬腿的走过去了。\n在山谷的最前面，是一片整齐的药田，然而所种的东西却并不起眼。\n一眼望去，就仿佛普通的果树，那果树上所结之物，也与世俗的葡萄相差仿佛。\n一串串的结在那里，倒也让人垂涎欲滴。\n当然，它的功效，远非葡萄可比。\n这种果子，在修仙界也算是异宝之一。\n名为天罗仙果。\n听名字，很容易误会成仙家之物，然而此灵药倒也并没有那么了得。\n其功效在于，服下此物，对于元神，有一些凝炼的效果。\n当然，实力到了林轩这样的等级，效果是微乎其微地，但不管如何，对于元神总有益处。\n林轩目光扫过，那天罗仙果一串一串的业已成熟，林轩自然不会放过，取出玉盒，将它们全部摘取下来了。\n生服此果，虽也有一定的用处，但自然比不上开炉炼丹的功效了。\n林轩才不会暴殄天物。\n先将此物收好在说。\n随后，他又朝着前面走过去了。\n“咦，这是……”\n林轩突然停下脚步，转过头颅，旁边不远，又一种珍奇的植物映入眼帘。\n形如灵芝，然而却散发出丝丝紫气，看上去古怪以极。\n“补天芝。”",
      "word_count": 677
    },
    "climax": {
      "core_conflict": "禁制破除后的灵药鉴定与资源收割：天罗仙果只是开胃菜，补天芝的现身才是真正的价值爆发；林轩以渡劫期视角判断其自用无用，却识破其对低阶修士增寿三五百年的交易价值，完成从破禁到尽收宝药的情绪释放。",
      "anchor_start": "“补天芝。”",
      "anchor_end": "其中以芙蓉雪参最为珍贵，可惜只有一株，不过也让林轩着实欢喜到了极处。",
      "text": "“补天芝。”\n林轩瞳孔微缩，脸上露出不可思议之色。\n五指微曲，将其中一株取到了手里。\n细细揣摩，果然是补天芝没错。\n平心来说，这种灵药对于渡劫期修仙者，几乎没有太大的用途。\n这可不是胡言乱语，渡劫期修仙者，服用补天芝，也不会有任何好处。\n不过对于渡劫以下的修仙者，这却是可遇而不可求的灵药了。\n补天芝不能用于炼丹，不过即便是生服，渡劫以下的修仙者，也可以增加三百年至五百年不等的寿元。\n对于新晋级的高阶修士来说，区区几百年的寿元不值一提，但对于寿元将尽的人物，好处则是不言而喻。\n差之毫厘，谬以千里，多出几百年的时间，说不定他们的修为就可以再晋一级。\n故而，补天芝的价值可以说是因人而异，但拿到拍卖会上，肯定是天价无疑。\n林轩自己用不上此物，但对他来说，却是奇货可居。\n以补天芝的价值，应该可以从其他老怪物的手里，换取一些珍贵材料的。\n补天芝数量不多，但也有十几株，林轩当然不会放过，全部笑纳掉了。\n随后林轩继续向前。\n……\n半个时辰后，才离开药园，里面有价值的灵药，全部都被林轩采摘一空。\n收获果然是极为丰厚，光是炼制对渡劫期存在有用的丹药，就得到了十余种。\n其中以芙蓉雪参最为珍贵，可惜只有一株，不过也让林轩着实欢喜到了极处。",
      "word_count": 515
    },
    "aftershock": {
      "anchor_start": "从药园里出来。",
      "anchor_end": "实力到了他们这个等级，随身携带的宝物或许不会太多，但每一样，肯定都非同小可。",
      "text": "从药园里出来。\n林轩又寻找到了灵狐尊者的宝库。\n里面各种各样的宝贝更是不计其数，论价值，远非一般的宗门家族可比。\n法宝、灵器、丹药、晶石，不一而足，各种各样的功法也有许多。\n林轩倒也懒得去一一品鉴了。\n于是他发出了一张传音符。\n数日后，数以千计的云隐宗弟子来到了此处。\n“拜见师傅！”\n领头的，居然是林轩的爱徒，公孙玉儿那丫头。\n这一切，都是林轩的授意。\n云隐宗今非昔比，门人弟子也越来越多，云隐山的灵脉虽面积广博，但如今也显得有些捉襟见肘了。\n当然，云隐宗总舵是不会改变的。\n但也可以考虑在合适的地点，建立分舵了。\n而这灵狐山就不错。\n绵延万里，灵气更是浓密，否则，灵狐尊者也不会将这里作为洞天福地。\n如今，他的徒子徒孙已被自己灭除，这一脉也就算从鼐龙界除名了，而这洞天福地若没有修仙者居住，荒废也就荒废了，与其如此，还不如收入云隐宗。\n这也算是肥水不流外人田的选择，而公孙玉儿作为自己的徒弟，亲近不用说，处理门派事务的能力，也是一流的。\n由她负责分舵，不论从哪个角度，都是绰绰有余了。\n此事算是告一段落，林轩唤来公孙玉儿，也不过是一番嘱托。\n随后林轩来到灵狐尊者的洞府。\n他还准备清点一下其他的宝物。\n嗯，就是自己灭杀宝蛇，与那老怪物后，由他们储物袋中所得。\n实力到了他们这个等级，随身携带的宝物或许不会太多，但每一样，肯定都非同小可。",
      "word_count": 570
    },
    "cliffhanger": {
      "anchor_start": "实力到了他们这个等级，随身携带的宝物或许不会太多，但每一样，肯定都非同小可。",
      "anchor_end": "顾名思义，乃是用先天灵宝的碎片为原料炼制而成地。",
      "text": "实力到了他们这个等级，随身携带的宝物或许不会太多，但每一样，肯定都非同小可。\n林轩可都还没有清点过，此时终于有闲暇自然要看上一看了。\n袖袍一拂，魔光大做，一件形状奇特的仙剑飞掠而出。\n粗略一看，像是一条蛇，然而表面，却有丝丝法则之力散发而出。\n先天残宝。\n此乃灭杀宝蛇化身后所得。\n顾名思义，乃是用先天灵宝的碎片为原料炼制而成地。",
      "word_count": 165
    }
  },
  "chapter_id": "ch_3221",
  "chapter_index": 3221,
  "prev_chapter_ending": "要将林轩挡住，自然是不可能的。\n袖袍一拂，一道青霞飞掠而出，略一转折，就幻化出数以百计的剑光来了。\n破空声大做，朝着前方斩落。\n然而那光幕却喷涌出无数符文来。\n那些符文一闪，幻化出无数晶莹的盾牌。\n剑光斩在上面。\n皆被盾牌挡住，竟没有分毫用途。\n林轩有些动容了。\n他虽然是随手一击，也没有放出宝物，但威力也是非同小可，这禁制居然能够挡住，足以证明它的不凡了。\n但想要林轩知难而退是不可能的。\n他原本没有用全力，而这样的一幕，更让林轩欣喜，这禁制非同小可，更证明里面灵药的价值，比自己想象的还要大得多。",
  "contrast": {
    "prompt": "请根据以下大纲与上章承接，撰写一篇 2000~2500 字的完整小说章节：\n\n【章节标题】：第八卷 上古隐秘_第三千二百一十八章 天罗仙果与补天芝\n【上一章结尾】：要将林轩挡住，自然是不可能的。\n袖袍一拂，一道青霞飞掠而出，略一转折，就幻化出数以百计的剑光来了。\n破空声大做，朝着前方斩落。\n然而那光幕却喷涌出无数符文来。\n那些符文一闪，幻化出无数晶莹的盾牌。\n剑光斩在上面。\n皆被盾牌挡住，竟没有分毫用途。\n林轩有些动容了。\n他虽然是随手一击，也没有放出宝物，但威力也是非同小可，这禁制居然能够挡住，足以证明它的不凡了。\n但想要林轩知难而退是不可能的。\n他原本没有用全力，而这样的一幕，更让林轩欣喜，这禁制非同小可，更证明里面灵药的价值，比自己想象的还要大得多。\n【本章大纲】：\n1. 林轩以九宫须臾剑破开灵狐尊者药园禁制，药园与其中灵药尽数显露。\n2. 林轩先收取成熟的天罗仙果，随后发现可让渡劫以下修士增寿三五百年的补天芝，并将其全部笑纳。\n3. 林轩将灵狐山纳入云隐宗版图，命公孙玉儿负责建立分舵，完成地盘与门派的扩张。\n4. 林轩回到洞府清点宝蛇等强敌储物所得，蛇形仙剑现世，被认出是先天残宝，留下新的悬念。\n\n【写作要求】：\n直接输出小说正文，保持情节连贯流畅，完成本章大纲所规划的所有情节走向。",
    "ai_draft": "剑光被盾牌尽数挡下，林轩不怒反喜。\n\n他袖中剑光一敛，抬手向前一招，九道寒芒自指尖鱼贯而出，绕身一匝，化作九口寸许长的小剑，悬于身侧。剑身晶莹，隐有符纹流转，一现出来，四周灵气便如被无形之手牵引，丝丝缕缕地朝剑上汇聚。\n\n“九宫须臾，去。”\n\n林轩屈指一弹。九口小剑一震，倏地散开，按九宫方位排布，剑尖齐齐指向前方光幕；下一瞬，剑身暴涨，化作九道丈许长的青虹，破空之声如裂帛。那光幕似也察觉凶险，符文狂涌，层层叠叠凝出数百面晶盾。\n\n九虹落下，并不硬撞。\n\n第一剑点在正中，晶盾微颤；第二剑已绕至左侧，第三剑自下而上挑开符纹缝隙……九剑连环，快得几乎不分先后，每一剑都恰落在前一剑震荡出的破绽上。起初晶盾尚能勉力支撑，到第七剑时，裂纹如蛛网般蔓延开来；第八剑一绞，符文崩散如雪；第九剑直刺而入——\n\n“嗤。”\n\n一声轻响，光幕中破开一孔，孔洞边缘的符纹挣扎着闪烁两下，便彻底暗淡下去。紧接着整片光幕轰然碎裂，化作漫天流萤，纷纷扬扬洒落。\n\n一股浓郁得化不开的药香扑面而来。\n\n林轩袍袖一拂，散尽残光，抬眼望去，饶是他见惯了宝物，也不由得目光一凝。\n\n光幕之后，竟是一处方圆数十里的山谷。谷中灵田齐整，阡陌纵横，每一畦都种着不同灵药；中央一株古木高逾十丈，枝头挂着数十枚拳头大的果子，通体赤红，隐隐透出金光，正是天罗仙果。树下一泓灵泉汩汩而流，泉水呈乳白色，氤氲着淡淡雾气。更远处，几片药圃中各色灵光交错，有的青翠欲滴，有的紫气氤氲，年份显然都极是不凡。\n\n“灵狐尊者倒真舍得下本钱。”林轩缓步走入谷中，目光扫过，心中已大致有数。这药园布设了不止一重禁制，外面那层光幕不过是第一道，谷内还隐约藏着几处杀阵，只是失了主持之人，威力大减。\n\n他也不急着动手，先走到古木之下。天罗仙果成熟在即，果皮上的金纹已连成完整的一圈，正是采摘的最佳时机。林轩取出玉盒，指尖凝出一缕精纯灵力，轻轻一托，一枚果子便自行脱落，稳稳落入盒中。他一连摘了三十六枚，将玉盒封好，才把目光投向树下那片不起眼的药圃。\n\n那药圃中长着十几株菌类，形如灵芝，伞盖却是半透明的淡青色，内里隐隐有一线金丝贯穿，仿佛天生便含着一缕生机。林轩蹲下身，仔细辨认片刻，眼中终于露出几分意外之色。\n\n“补天芝？”\n\n他伸手虚虚一引，一株补天芝连根拔起，悬在掌心。那金丝在光下流转，生机盎然，确是与古籍所载一般无二。此物不能增进修为，也无斗法之能，却有一样逆天的用处——炼成丹药，可让渡劫期以下的修士增寿三五百载。\n\n三五百载，对凡人而言是几世几劫，对修士来说，也足以让一个卡在瓶颈上的人多出无数次冲击的余地。\n\n林轩沉默了一息，随即笑了笑。\n\n他修行至今，靠的从不是天赐的寿元，可这等东西，谁又会嫌多？更何况云隐宗上下弟子众多，将来总有用得上的时候。\n\n“也罢，既然撞见了，便都笑纳了。”\n\n他不再迟疑，取出专门存放灵植的玉匣，小心翼翼地将十几株补天芝尽数起出，连根部的灵土也一并封了进去。起完最后一株时，他特意留下两株幼苗未曾动它——凡事留一线，这药园既然能长出补天芝，说明此地灵脉不俗，日后未必不能再育。\n\n收拾停当，林轩又在谷中巡了一圈，将几处残阵一一破去。药圃里的其他灵药虽不及天罗仙果与补天芝珍贵，却也都是难得的材料，他挑年份足够的取了，余下的仍留在原处。\n\n做完这些，他身形一纵，落在谷口一块青石上，取出传讯玉符。\n\n灵力注入，符上光华一闪。\n\n“玉儿。”\n\n片刻之后，玉符中传来公孙玉儿清亮的声音：“师尊？”\n\n“灵狐山已破，灵狐尊者不知所踪，山中残余妖修多半已散。你带一队内门弟子过来，将此地接手。”林轩顿了顿，又道，“此处灵脉尚可，药园也还完整，便在这里建一处分舵，往后作为我云隐宗向东的门户。”\n\n玉符那头静了一瞬，随即响起公孙玉儿略带惊讶的声音：“灵狐山？那可是灵狐尊者经营了数百年的根基……”\n\n“根基再深，也挡不住剑。”林轩淡淡道，“你只管来。路上若遇抵抗，不必留情；肯降的，按宗门规矩收编。分舵之事，你自己拿主意，拿不准的再问我。”\n\n“是，弟子明白。”\n\n收了玉符，林轩又回头望了一眼那座山谷。天罗仙果的树冠在风中轻轻摇曳，赤金相映，煞是好看。他没有多留，袖袍一展，化作一道青光，朝洞府方向飞去。\n\n回到洞府时，已是三日之后。\n\n林轩在静室中盘膝坐下，先将天罗仙果与补天芝分别封存妥当，这才取出此番征战所得的其他储物袋，一一摆在身前。\n\n宝蛇、灵狐尊者手下的几员妖将，还有沿途顺手收拾的几名强敌，零零总总竟堆了七八个袋子。他随手拿起一个，神识探入，里面的灵石、材料、丹药便如流水般在心头掠过。\n\n大多寻常。\n\n直到他打开最后一个储物袋。\n\n那袋子通体漆黑，袋口以一根蛇筋系着，解开时还带着一丝阴冷的腥气。林轩神识一扫，眉头微不可察地动了动，探手一抓，一柄长剑便从袋中飞出，悬在半空。\n\n剑长约三尺，剑身蜿蜒如蛇，通体暗青，剑脊上生着一排细密的鳞纹，剑柄处更雕着一颗狰狞蛇首，两颗蛇眼以血色宝石嵌成，幽光流转，仿佛活物。剑一出袋，静室中的温度便似低了几分，一股阴寒锋锐之气弥漫开来。\n\n林轩目光落在剑身上，久久没有移开。\n\n他伸出手指，隔空轻轻一划。指尖距剑身尚有寸许，便觉一股凌厉之意逆冲而上，皮肤微微发麻。\n\n“……先天残宝？”\n\n他低声自语，语气里有几分凝重，也有几分不解。此剑气息古怪，明明是先天之属，却残缺不全，仿佛被人硬生生打碎后，又以某种手段强行拼合。那蛇首处的血色宝石，更像是后来嵌入，用以镇压剑中某种躁动的东西。\n\n林轩将灵力缓缓渡入剑身。\n\n刹那间，剑上鳞纹齐齐亮起，一声若有若无的蛇嘶自剑中传出，尖锐刺耳，直钻识海。林轩识海中剑意微微一荡，便将那声音压了下去，可剑身深处那点躁动，却并未平息，反而像被惊醒了什么，一下一下地搏动着。\n\n他盯着那柄蛇剑，眼神渐渐沉了下来。\n\n“宝蛇……”他轻声念出这个名字，忽然觉得，自己似乎从一开始就小看了这头畜生。",
    "human_original": "第八卷 上古隐秘_第三千二百一十八章 天罗仙果与补天芝\n\n第三千二百一十八章\n\n天罗仙果与补天芝\n\n“看来这位灵狐尊者，身家在渡劫期存在中，也算颇为富有之人了。”\n\n林轩喃喃自语的声音传入耳朵，此事对他来说，算是一意外收获。\n\n随后林轩谈笑间袖袍一拂，银光耀目，九宫须臾剑自衣袖间鱼游而出。\n\n“合！”\n\n也不见林轩多余的动作，那数十柄仙剑就朝着同一方向激射而去了。\n\n随后法则之力逸散而出，半空中灵芒大做，却是一柄银光闪闪的仙剑在半空中若隐若现的鱼跃而出。\n\n长数十丈有余，银光犀利，那声威看上去当真是无以伦比。\n\n随后势夹万钧的朝着前方斩去。\n\n刺啦……\n\n这一次丝毫悬念也无，那光幕虽然再一次将晶莹小盾幻化而出。\n\n但根本就没有用途。\n\n林轩的随手一击，此禁制或许还能挡住，但此时在九宫须臾剑的威能下，却成了班门弄斧。\n\n说成是螳臂挡车也不为过，清脆的碎裂声传入耳朵。\n\n那看似凝厚玄妙的光幕寸寸碎裂掉了。\n\n再无禁制阻隔，药园中的一切自然是显露无遗了。\n\n一阵沁人心脾的清香扑面而出。\n\n林轩脸上闪过一丝喜色，越发肯定自己此行将大有收获。\n\n整座药园是位于一小小的山谷，就面积来说，其实并不出色。\n\n林轩粗略一估，前后也不过数亩。\n\n林轩将神识放出，确定再没有禁制隐伏，于是一抬腿的走过去了。\n\n在山谷的最前面，是一片整齐的药田，然而所种的东西却并不起眼。\n\n一眼望去，就仿佛普通的果树，那果树上所结之物，也与世俗的葡萄相差仿佛。\n\n一串串的结在那里，倒也让人垂涎欲滴。\n\n当然，它的功效，远非葡萄可比。\n\n这种果子，在修仙界也算是异宝之一。\n\n名为天罗仙果。\n\n听名字，很容易误会成仙家之物，然而此灵药倒也并没有那么了得。\n\n其功效在于，服下此物，对于元神，有一些凝炼的效果。\n\n当然，实力到了林轩这样的等级，效果是微乎其微地，但不管如何，对于元神总有益处。\n\n林轩目光扫过，那天罗仙果一串一串的业已成熟，林轩自然不会放过，取出玉盒，将它们全部摘取下来了。\n\n生服此果，虽也有一定的用处，但自然比不上开炉炼丹的功效了。\n\n林轩才不会暴殄天物。\n\n先将此物收好在说。\n\n随后，他又朝着前面走过去了。\n\n“咦，这是……”\n\n林轩突然停下脚步，转过头颅，旁边不远，又一种珍奇的植物映入眼帘。\n\n形如灵芝，然而却散发出丝丝紫气，看上去古怪以极。\n\n“补天芝。”\n\n林轩瞳孔微缩，脸上露出不可思议之色。\n\n五指微曲，将其中一株取到了手里。\n\n细细揣摩，果然是补天芝没错。\n\n平心来说，这种灵药对于渡劫期修仙者，几乎没有太大的用途。\n\n这可不是胡言乱语，渡劫期修仙者，服用补天芝，也不会有任何好处。\n\n不过对于渡劫以下的修仙者，这却是可遇而不可求的灵药了。\n\n补天芝不能用于炼丹，不过即便是生服，渡劫以下的修仙者，也可以增加三百年至五百年不等的寿元。\n\n对于新晋级的高阶修士来说，区区几百年的寿元不值一提，但对于寿元将尽的人物，好处则是不言而喻。\n\n差之毫厘，谬以千里，多出几百年的时间，说不定他们的修为就可以再晋一级。\n\n故而，补天芝的价值可以说是因人而异，但拿到拍卖会上，肯定是天价无疑。\n\n林轩自己用不上此物，但对他来说，却是奇货可居。\n\n以补天芝的价值，应该可以从其他老怪物的手里，换取一些珍贵材料的。\n\n补天芝数量不多，但也有十几株，林轩当然不会放过，全部笑纳掉了。\n\n随后林轩继续向前。\n\n……\n\n半个时辰后，才离开药园，里面有价值的灵药，全部都被林轩采摘一空。\n\n收获果然是极为丰厚，光是炼制对渡劫期存在有用的丹药，就得到了十余种。\n\n其中以芙蓉雪参最为珍贵，可惜只有一株，不过也让林轩着实欢喜到了极处。\n\n……\n\n从药园里出来。\n\n林轩又寻找到了灵狐尊者的宝库。\n\n里面各种各样的宝贝更是不计其数，论价值，远非一般的宗门家族可比。\n\n法宝、灵器、丹药、晶石，不一而足，各种各样的功法也有许多。\n\n林轩倒也懒得去一一品鉴了。\n\n于是他发出了一张传音符。\n\n数日后，数以千计的云隐宗弟子来到了此处。\n\n“拜见师傅！”\n\n领头的，居然是林轩的爱徒，公孙玉儿那丫头。\n\n这一切，都是林轩的授意。\n\n云隐宗今非昔比，门人弟子也越来越多，云隐山的灵脉虽面积广博，但如今也显得有些捉襟见肘了。\n\n当然，云隐宗总舵是不会改变的。\n\n但也可以考虑在合适的地点，建立分舵了。\n\n而这灵狐山就不错。\n\n绵延万里，灵气更是浓密，否则，灵狐尊者也不会将这里作为洞天福地。\n\n如今，他的徒子徒孙已被自己灭除，这一脉也就算从鼐龙界除名了，而这洞天福地若没有修仙者居住，荒废也就荒废了，与其如此，还不如收入云隐宗。\n\n这也算是肥水不流外人田的选择，而公孙玉儿作为自己的徒弟，亲近不用说，处理门派事务的能力，也是一流的。\n\n由她负责分舵，不论从哪个角度，都是绰绰有余了。\n\n此事算是告一段落，林轩唤来公孙玉儿，也不过是一番嘱托。\n\n随后林轩来到灵狐尊者的洞府。\n\n他还准备清点一下其他的宝物。\n\n嗯，就是自己灭杀宝蛇，与那老怪物后，由他们储物袋中所得。\n\n实力到了他们这个等级，随身携带的宝物或许不会太多，但每一样，肯定都非同小可。\n\n林轩可都还没有清点过，此时终于有闲暇自然要看上一看了。\n\n袖袍一拂，魔光大做，一件形状奇特的仙剑飞掠而出。\n\n粗略一看，像是一条蛇，然而表面，却有丝丝法则之力散发而出。\n\n先天残宝。\n\n此乃灭杀宝蛇化身后所得。\n\n顾名思义，乃是用先天灵宝的碎片为原料炼制而成地。",
    "ai_word_count": 2423,
    "human_word_count": 2239
  }
}